root@lamp-s-1vcpu-1gb-tor1-01:~# tcpdump -i eth0
tcpdump: verbose output suppressed, use -v or -vv for full protocol decode
listening on eth0, link-type EN10MB (Ethernet), capture size 262144 bytes
13:22:49.887714 IP lamp-s-1vcpu-1gb-tor1-01.ssh > CPEf81d0fa0c6a3-CMf81d0fa0c6a0.cpe.net.fido.ca.61769: Flags [P.], seq 1339620023:1339620131, ack 3387140009, win 1452, options [nop,nop,TS val 2054136315 ecr 410549915], length 108
13:22:49.887818 IP lamp-s-1vcpu-1gb-tor1-01.ssh > CPEf81d0fa0c6a3-CMf81d0fa0c6a0.cpe.net.fido.ca.61769: Flags [P.], seq 108:144, ack 1, win 1452, options [nop,nop,TS val 2054136315 ecr 410549915], length 36
13:22:49.887914 IP lamp-s-1vcpu-1gb-tor1-01.ssh > CPEf81d0fa0c6a3-CMf81d0fa0c6a0.cpe.net.fido.ca.61769: Flags [P.], seq 144:252, ack 1, win 1452, options [nop,nop,TS val 2054136315 ecr 410549915], length 108
13:22:49.887991 IP lamp-s-1vcpu-1gb-tor1-01.ssh > CPEf81d0fa0c6a3-CMf81d0fa0c6a0.cpe.net.fido.ca.61769: Flags [P.], seq 252:288, ack 1, win 1452, options [nop,nop,TS val 2054136315 ecr 410549915], length 36
13:22:49.890702 IP lamp-s-1vcpu-1gb-tor1-01.ssh > CPEf81d0fa0c6a3-CMf81d0fa0c6a0.cpe.net.fido.ca.61769: Flags [P.], seq 288:556, ack 1, win 1452, options [nop,nop,TS val 2054136318 ecr 410549915], length 268
13:22:49.890798 IP lamp-s-1vcpu-1gb-tor1-01.ssh > CPEf81d0fa0c6a3-CMf81d0fa0c6a0.cpe.net.fido.ca.61769: Flags [P.], seq 556:592, ack 1, win 1452, options [nop,nop,TS val 2054136318 ecr 410549915], length 36
13:22:49.890950 IP lamp-s-1vcpu-1gb-tor1-01.ssh > CPEf81d0fa0c6a3-CMf81d0fa0c6a0.cpe.net.fido.ca.61769: Flags [P.], seq 592:836, ack 1, win 1452, options [nop,nop,TS val 2054136318 ecr 410549915], length 244
13:22:49.891031 IP lamp-s-1vcpu-1gb-tor1-01.ssh > CPEf81d0fa0c6a3-CMf81d0fa0c6a0.cpe.net.fido.ca.61769: Flags [P.], seq 836:872, ack 1, win 1452, options [nop,nop,TS val 2054136318 ecr 410549915], length 36
13:22:49.891138 IP lamp-s-1vcpu-1gb-tor1-01.ssh > CPEf81d0fa0c6a3-CMf81d0fa0c6a0.cpe.net.fido.ca.61769: Flags [P.], seq 872:1116, ack 1, win 1452, options [nop,nop,TS val 2054136319 ecr 410549915], length 244
13:22:49.918374 IP CPEf81d0fa0c6a3-CMf81d0fa0c6a0.cpe.net.fido.ca.61769 > lamp-s-1vcpu-1gb-tor1-01.ssh: Flags [.], ack 0, win 32767, options [nop,nop,TS val 410549932 ecr 2054136308], length 0
13:22:49.918461 IP lamp-s-1vcpu-1gb-tor1-01.ssh > CPEf81d0fa0c6a3-CMf81d0fa0c6a0.cpe.net.fido.ca.61769: Flags [P.], seq 1116:2832, ack 1, win 1452, options [nop,nop,TS val 2054136346 ecr 410549932], length 1716
13:22:49.918493 IP CPEf81d0fa0c6a3-CMf81d0fa0c6a0.cpe.net.fido.ca.61769 > lamp-s-1vcpu-1gb-tor1-01.ssh: Flags [.], ack 144, win 32765, options [nop,nop,TS val 410549936 ecr 2054136315], length 0
13:22:49.918508 IP CPEf81d0fa0c6a3-CMf81d0fa0c6a0.cpe.net.fido.ca.61769 > lamp-s-1vcpu-1gb-tor1-01.ssh: Flags [.], ack 288, win 32763, options [nop,nop,TS val 410549936 ecr 2054136315], length 0
13:22:49.918517 IP CPEf81d0fa0c6a3-CMf81d0fa0c6a0.cpe.net.fido.ca.61769 > lamp-s-1vcpu-1gb-tor1-01.ssh: Flags [.], ack 592, win 32763, options [nop,nop,TS val 410549938 ecr 2054136318], length 0
13:22:49.918523 IP CPEf81d0fa0c6a3-CMf81d0fa0c6a0.cpe.net.fido.ca.61769 > lamp-s-1vcpu-1gb-tor1-01.ssh: Flags [.], ack 1116, win 32755, options [nop,nop,TS val 410549938 ecr 2054136319], length 0
13:22:49.918822 IP lamp-s-1vcpu-1gb-tor1-01.ssh > CPEf81d0fa0c6a3-CMf81d0fa0c6a0.cpe.net.fido.ca.61769: Flags [P.], seq 2832:3060, ack 1, win 1452, options [nop,nop,TS val 2054136346 ecr 410549938], length 228
13:22:49.919107 IP lamp-s-1vcpu-1gb-tor1-01.ssh > CPEf81d0fa0c6a3-CMf81d0fa0c6a0.cpe.net.fido.ca.61769: Flags [P.], seq 3096:3340, ack 1, win 1452, options [nop,nop,TS val 2054136346 ecr 410549938], length 244
13:22:49.919379 IP lamp-s-1vcpu-1gb-tor1-01.ssh > CPEf81d0fa0c6a3-CMf81d0fa0c6a0.cpe.net.fido.ca.61769: Flags [P.], seq 3376:3604, ack 1, win 1452, options [nop,nop,TS val 2054136347 ecr 410549938], length 228
13:22:49.919708 IP lamp-s-1vcpu-1gb-tor1-01.ssh > CPEf81d0fa0c6a3-CMf81d0fa0c6a0.cpe.net.fido.ca.61769: Flags [P.], seq 3640:3868, ack 1, win 1452, options [nop,nop,TS val 2054136347 ecr 410549938], length 228
13:22:49.919901 IP lamp-s-1vcpu-1gb-tor1-01.ssh > CPEf81d0fa0c6a3-CMf81d0fa0c6a0.cpe.net.fido.ca.61769: Flags [P.], seq 3904:4132, ack 1, win 1452, options [nop,nop,TS val 2054136347 ecr 410549938], length 228
13:22:49.920115 IP lamp-s-1vcpu-1gb-tor1-01.ssh > CPEf81d0fa0c6a3-CMf81d0fa0c6a0.cpe.net.fido.ca.61769: Flags [P.], seq 4168:4404, ack 1, win 1452, options [nop,nop,TS val 2054136347 ecr 410549938], length 236
13:22:49.920316 IP lamp-s-1vcpu-1gb-tor1-01.ssh > CPEf81d0fa0c6a3-CMf81d0fa0c6a0.cpe.net.fido.ca.61769: Flags [P.], seq 4440:4684, ack 1, win 1452, options [nop,nop,TS val 2054136348 ecr 410549938], length 244
13:22:49.920490 IP lamp-s-1vcpu-1gb-tor1-01.ssh > CPEf81d0fa0c6a3-CMf81d0fa0c6a0.cpe.net.fido.ca.61769: Flags [P.], seq 4720:4964, ack 1, win 1452, options [nop,nop,TS val 2054136348 ecr 410549938], length 244
13:22:49.920765 IP lamp-s-1vcpu-1gb-tor1-01.ssh > CPEf81d0fa0c6a3-CMf81d0fa0c6a0.cpe.net.fido.ca.61769: Flags [P.], seq 5000:5244, ack 1, win 1452, options [nop,nop,TS val 2054136348 ecr 410549938], length 244
13:22:49.934193 IP CPEf81d0fa0c6a3-CMf81d0fa0c6a0.cpe.net.fido.ca.61769 > lamp-s-1vcpu-1gb-tor1-01.ssh: Flags [.], ack 2832, win 32741, options [nop,nop,TS val 410549965 ecr 2054136346], length 0
13:22:49.934272 IP lamp-s-1vcpu-1gb-tor1-01.ssh > CPEf81d0fa0c6a3-CMf81d0fa0c6a0.cpe.net.fido.ca.61769: Flags [P.], seq 5280:6960, ack 1, win 1452, options [nop,nop,TS val 2054136362 ecr 410549965], length 1680
13:22:49.934306 IP CPEf81d0fa0c6a3-CMf81d0fa0c6a0.cpe.net.fido.ca.61769 > lamp-s-1vcpu-1gb-tor1-01.ssh: Flags [.], ack 3096, win 32763, options [nop,nop,TS val 410549966 ecr 2054136346], length 0
13:22:49.934321 IP CPEf81d0fa0c6a3-CMf81d0fa0c6a0.cpe.net.fido.ca.61769 > lamp-s-1vcpu-1gb-tor1-01.ssh: Flags [.], ack 4168, win 32747, options [nop,nop,TS val 410549966 ecr 2054136347], length 0
13:22:49.934336 IP CPEf81d0fa0c6a3-CMf81d0fa0c6a0.cpe.net.fido.ca.61769 > lamp-s-1vcpu-1gb-tor1-01.ssh: Flags [.], ack 4440, win 32763, options [nop,nop,TS val 410549967 ecr 2054136348], length 0
13:22:49.934346 IP CPEf81d0fa0c6a3-CMf81d0fa0c6a0.cpe.net.fido.ca.61769 > lamp-s-1vcpu-1gb-tor1-01.ssh: Flags [.], ack 5280, win 32767, options [nop,nop,TS val 410549967 ecr 2054136348], length 0
13:22:49.934602 IP lamp-s-1vcpu-1gb-tor1-01.ssh > CPEf81d0fa0c6a3-CMf81d0fa0c6a0.cpe.net.fido.ca.61769: Flags [P.], seq 6960:7196, ack 1, win 1452, options [nop,nop,TS val 2054136362 ecr 410549967], length 236
13:22:49.934860 IP lamp-s-1vcpu-1gb-tor1-01.ssh > CPEf81d0fa0c6a3-CMf81d0fa0c6a0.cpe.net.fido.ca.61769: Flags [P.], seq 7232:7476, ack 1, win 1452, options [nop,nop,TS val 2054136362 ecr 410549967], length 244
13:22:49.935089 IP lamp-s-1vcpu-1gb-tor1-01.ssh > CPEf81d0fa0c6a3-CMf81d0fa0c6a0.cpe.net.fido.ca.61769: Flags [P.], seq 7512:7748, ack 1, win 1452, options [nop,nop,TS val 2054136362 ecr 410549967], length 236
13:22:49.935324 IP lamp-s-1vcpu-1gb-tor1-01.ssh > CPEf81d0fa0c6a3-CMf81d0fa0c6a0.cpe.net.fido.ca.61769: Flags [P.], seq 7784:8020, ack 1, win 1452, options [nop,nop,TS val 2054136363 ecr 410549967], length 236
13:22:49.935590 IP lamp-s-1vcpu-1gb-tor1-01.ssh > CPEf81d0fa0c6a3-CMf81d0fa0c6a0.cpe.net.fido.ca.61769: Flags [P.], seq 8056:8292, ack 1, win 1452, options [nop,nop,TS val 2054136363 ecr 410549967], length 236
13:22:49.935824 IP lamp-s-1vcpu-1gb-tor1-01.ssh > CPEf81d0fa0c6a3-CMf81d0fa0c6a0.cpe.net.fido.ca.61769: Flags [P.], seq 8328:8564, ack 1, win 1452, options [nop,nop,TS val 2054136363 ecr 410549967], length 236
13:22:49.936042 IP lamp-s-1vcpu-1gb-tor1-01.ssh > CPEf81d0fa0c6a3-CMf81d0fa0c6a0.cpe.net.fido.ca.61769: Flags [P.], seq 8600:8844, ack 1, win 1452, options [nop,nop,TS val 2054136363 ecr 410549967], length 244
13:22:49.936319 IP lamp-s-1vcpu-1gb-tor1-01.ssh > CPEf81d0fa0c6a3-CMf81d0fa0c6a0.cpe.net.fido.ca.61769: Flags [P.], seq 8880:9124, ack 1, win 1452, options [nop,nop,TS val 2054136364 ecr 410549967], length 244
13:22:49.936574 IP lamp-s-1vcpu-1gb-tor1-01.ssh > CPEf81d0fa0c6a3-CMf81d0fa0c6a0.cpe.net.fido.ca.61769: Flags [P.], seq 9160:9404, ack 1, win 1452, options [nop,nop,TS val 2054136364 ecr 410549967], length 244
13:22:49.936770 IP lamp-s-1vcpu-1gb-tor1-01.ssh > CPEf81d0fa0c6a3-CMf81d0fa0c6a0.cpe.net.fido.ca.61769: Flags [P.], seq 9440:9684, ack 1, win 1452, options [nop,nop,TS val 2054136364 ecr 410549967], length 244
13:22:49.936961 IP lamp-s-1vcpu-1gb-tor1-01.ssh > CPEf81d0fa0c6a3-CMf81d0fa0c6a0.cpe.net.fido.ca.61769: Flags [P.], seq 9684:9936, ack 1, win 1452, options [nop,nop,TS val 2054136364 ecr 410549967], length 252
13:22:49.937163 IP lamp-s-1vcpu-1gb-tor1-01.ssh > CPEf81d0fa0c6a3-CMf81d0fa0c6a0.cpe.net.fido.ca.61769: Flags [P.], seq 9936:10612, ack 1, win 1452, options [nop,nop,TS val 2054136365 ecr 410549967], length 676
13:22:49.937361 IP lamp-s-1vcpu-1gb-tor1-01.ssh > CPEf81d0fa0c6a3-CMf81d0fa0c6a0.cpe.net.fido.ca.61769: Flags [P.], seq 10612:11496, ack 1, win 1452, options [nop,nop,TS val 2054136365 ecr 410549967], length 884
13:22:49.937559 IP lamp-s-1vcpu-1gb-tor1-01.ssh > CPEf81d0fa0c6a3-CMf81d0fa0c6a0.cpe.net.fido.ca.61769: Flags [P.], seq 11496:11748, ack 1, win 1452, options [nop,nop,TS val 2054136365 ecr 410549967], length 252
13:22:49.937701 IP lamp-s-1vcpu-1gb-tor1-01.ssh > CPEf81d0fa0c6a3-CMf81d0fa0c6a0.cpe.net.fido.ca.61769: Flags [P.], seq 11748:12000, ack 1, win 1452, options [nop,nop,TS val 2054136365 ecr 410549967], length 252
13:22:49.937822 IP lamp-s-1vcpu-1gb-tor1-01.ssh > CPEf81d0fa0c6a3-CMf81d0fa0c6a0.cpe.net.fido.ca.61769: Flags [P.], seq 12000:12252, ack 1, win 1452, options [nop,nop,TS val 2054136365 ecr 410549967], length 252
13:22:49.937963 IP lamp-s-1vcpu-1gb-tor1-01.ssh > CPEf81d0fa0c6a3-CMf81d0fa0c6a0.cpe.net.fido.ca.61769: Flags [P.], seq 12252:12504, ack 1, win 1452, options [nop,nop,TS val 2054136365 ecr 410549967], length 252
13:22:49.938128 IP lamp-s-1vcpu-1gb-tor1-01.ssh > CPEf81d0fa0c6a3-CMf81d0fa0c6a0.cpe.net.fido.ca.61769: Flags [P.], seq 12504:12756, ack 1, win 1452, options [nop,nop,TS val 2054136366 ecr 410549967], length 252
13:22:49.938253 IP lamp-s-1vcpu-1gb-tor1-01.ssh > CPEf81d0fa0c6a3-CMf81d0fa0c6a0.cpe.net.fido.ca.61769: Flags [P.], seq 12756:13008, ack 1, win 1452, options [nop,nop,TS val 2054136366 ecr 410549967], length 252
13:22:49.938371 IP lamp-s-1vcpu-1gb-tor1-01.ssh > CPEf81d0fa0c6a3-CMf81d0fa0c6a0.cpe.net.fido.ca.61769: Flags [P.], seq 13008:13260, ack 1, win 1452, options [nop,nop,TS val 2054136366 ecr 410549967], length 252
13:22:49.938492 IP lamp-s-1vcpu-1gb-tor1-01.ssh > CPEf81d0fa0c6a3-CMf81d0fa0c6a0.cpe.net.fido.ca.61769: Flags [P.], seq 13260:13512, ack 1, win 1452, options [nop,nop,TS val 2054136366 ecr 410549967], length 252
13:22:49.938608 IP lamp-s-1vcpu-1gb-tor1-01.ssh > CPEf81d0fa0c6a3-CMf81d0fa0c6a0.cpe.net.fido.ca.61769: Flags [P.], seq 13512:13764, ack 1, win 1452, options [nop,nop,TS val 2054136366 ecr 410549967], length 252
13:22:49.938746 IP lamp-s-1vcpu-1gb-tor1-01.ssh > CPEf81d0fa0c6a3-CMf81d0fa0c6a0.cpe.net.fido.ca.61769: Flags [P.], seq 13764:14016, ack 1, win 1452, options [nop,nop,TS val 2054136366 ecr 410549967], length 252
13:22:49.938869 IP lamp-s-1vcpu-1gb-tor1-01.ssh > CPEf81d0fa0c6a3-CMf81d0fa0c6a0.cpe.net.fido.ca.61769: Flags [P.], seq 14016:14268, ack 1, win 1452, options [nop,nop,TS val 2054136366 ecr 410549967], length 252
13:22:49.939006 IP lamp-s-1vcpu-1gb-tor1-01.ssh > CPEf81d0fa0c6a3-CMf81d0fa0c6a0.cpe.net.fido.ca.61769: Flags [P.], seq 14268:14520, ack 1, win 1452, options [nop,nop,TS val 2054136366 ecr 410549967], length 252
13:22:49.939128 IP lamp-s-1vcpu-1gb-tor1-01.ssh > CPEf81d0fa0c6a3-CMf81d0fa0c6a0.cpe.net.fido.ca.61769: Flags [P.], seq 14520:14772, ack 1, win 1452, options [nop,nop,TS val 2054136367 ecr 410549967], length 252
13:22:49.939244 IP lamp-s-1vcpu-1gb-tor1-01.ssh > CPEf81d0fa0c6a3-CMf81d0fa0c6a0.cpe.net.fido.ca.61769: Flags [P.], seq 14772:15024, ack 1, win 1452, options [nop,nop,TS val 2054136367 ecr 410549967], length 252
13:22:49.939360 IP lamp-s-1vcpu-1gb-tor1-01.ssh > CPEf81d0fa0c6a3-CMf81d0fa0c6a0.cpe.net.fido.ca.61769: Flags [P.], seq 15024:15276, ack 1, win 1452, options [nop,nop,TS val 2054136367 ecr 410549967], length 252
13:22:49.939517 IP lamp-s-1vcpu-1gb-tor1-01.ssh > CPEf81d0fa0c6a3-CMf81d0fa0c6a0.cpe.net.fido.ca.61769: Flags [P.], seq 15276:15528, ack 1, win 1452, options [nop,nop,TS val 2054136367 ecr 410549967], length 252
13:22:49.955978 IP CPEf81d0fa0c6a3-CMf81d0fa0c6a0.cpe.net.fido.ca.61769 > lamp-s-1vcpu-1gb-tor1-01.ssh: Flags [.], ack 7196, win 32738, options [nop,nop,TS val 410549981 ecr 2054136362], length 0
13:22:49.956080 IP lamp-s-1vcpu-1gb-tor1-01.ssh > CPEf81d0fa0c6a3-CMf81d0fa0c6a0.cpe.net.fido.ca.61769: Flags [P.], seq 15528:15780, ack 1, win 1452, options [nop,nop,TS val 2054136383 ecr 410549981], length 252
13:22:49.956121 IP CPEf81d0fa0c6a3-CMf81d0fa0c6a0.cpe.net.fido.ca.61769 > lamp-s-1vcpu-1gb-tor1-01.ssh: Flags [.], ack 7748, win 32729, options [nop,nop,TS val 410549981 ecr 2054136362], length 0
13:22:49.956137 IP CPEf81d0fa0c6a3-CMf81d0fa0c6a0.cpe.net.fido.ca.61769 > lamp-s-1vcpu-1gb-tor1-01.ssh: Flags [P.], seq 1:37, ack 7748, win 32768, options [nop,nop,TS val 410549981 ecr 2054136362], length 36
13:22:49.956581 IP lamp-s-1vcpu-1gb-tor1-01.ssh > CPEf81d0fa0c6a3-CMf81d0fa0c6a0.cpe.net.fido.ca.61769: Flags [P.], seq 15780:16632, ack 37, win 1452, options [nop,nop,TS val 2054136384 ecr 410549981], length 852
13:22:49.956769 IP lamp-s-1vcpu-1gb-tor1-01.ssh > CPEf81d0fa0c6a3-CMf81d0fa0c6a0.cpe.net.fido.ca.61769: Flags [P.], seq 16632:16884, ack 37, win 1452, options [nop,nop,TS val 2054136384 ecr 410549981], length 252
13:22:49.956939 IP lamp-s-1vcpu-1gb-tor1-01.ssh > CPEf81d0fa0c6a3-CMf81d0fa0c6a0.cpe.net.fido.ca.61769: Flags [P.], seq 16884:17136, ack 37, win 1452, options [nop,nop,TS val 2054136384 ecr 410549981], length 252
13:22:49.957116 IP lamp-s-1vcpu-1gb-tor1-01.ssh > CPEf81d0fa0c6a3-CMf81d0fa0c6a0.cpe.net.fido.ca.61769: Flags [P.], seq 17136:17388, ack 37, win 1452, options [nop,nop,TS val 2054136384 ecr 410549981], length 252
13:22:49.957295 IP lamp-s-1vcpu-1gb-tor1-01.ssh > CPEf81d0fa0c6a3-CMf81d0fa0c6a0.cpe.net.fido.ca.61769: Flags [P.], seq 17388:17640, ack 37, win 1452, options [nop,nop,TS val 2054136385 ecr 410549981], length 252
13:22:49.957520 IP lamp-s-1vcpu-1gb-tor1-01.ssh > CPEf81d0fa0c6a3-CMf81d0fa0c6a0.cpe.net.fido.ca.61769: Flags [P.], seq 17640:17892, ack 37, win 1452, options [nop,nop,TS val 2054136385 ecr 410549981], length 252
13:22:49.957719 IP lamp-s-1vcpu-1gb-tor1-01.ssh > CPEf81d0fa0c6a3-CMf81d0fa0c6a0.cpe.net.fido.ca.61769: Flags [P.], seq 17892:18144, ack 37, win 1452, options [nop,nop,TS val 2054136385 ecr 410549981], length 252
13:22:49.957892 IP lamp-s-1vcpu-1gb-tor1-01.ssh > CPEf81d0fa0c6a3-CMf81d0fa0c6a0.cpe.net.fido.ca.61769: Flags [P.], seq 18144:18396, ack 37, win 1452, options [nop,nop,TS val 2054136385 ecr 410549981], length 252
13:22:49.958063 IP lamp-s-1vcpu-1gb-tor1-01.ssh > CPEf81d0fa0c6a3-CMf81d0fa0c6a0.cpe.net.fido.ca.61769: Flags [P.], seq 18396:18648, ack 37, win 1452, options [nop,nop,TS val 2054136385 ecr 410549981], length 252
13:22:49.958234 IP lamp-s-1vcpu-1gb-tor1-01.ssh > CPEf81d0fa0c6a3-CMf81d0fa0c6a0.cpe.net.fido.ca.61769: Flags [P.], seq 18648:18900, ack 37, win 1452, options [nop,nop,TS val 2054136386 ecr 410549981], length 252
13:22:49.958401 IP lamp-s-1vcpu-1gb-tor1-01.ssh > CPEf81d0fa0c6a3-CMf81d0fa0c6a0.cpe.net.fido.ca.61769: Flags [P.], seq 18900:19152, ack 37, win 1452, options [nop,nop,TS val 2054136386 ecr 410549981], length 252
13:22:49.958570 IP lamp-s-1vcpu-1gb-tor1-01.ssh > CPEf81d0fa0c6a3-CMf81d0fa0c6a0.cpe.net.fido.ca.61769: Flags [P.], seq 19152:19404, ack 37, win 1452, options [nop,nop,TS val 2054136386 ecr 410549981], length 252
13:22:49.958745 IP lamp-s-1vcpu-1gb-tor1-01.ssh > CPEf81d0fa0c6a3-CMf81d0fa0c6a0.cpe.net.fido.ca.61769: Flags [P.], seq 19404:19656, ack 37, win 1452, options [nop,nop,TS val 2054136386 ecr 410549981], length 252
13:22:49.965064 IP CPEf81d0fa0c6a3-CMf81d0fa0c6a0.cpe.net.fido.ca.61769 > lamp-s-1vcpu-1gb-tor1-01.ssh: Flags [.], ack 9124, win 32746, options [nop,nop,TS val 410549982 ecr 2054136364], length 0
13:22:49.965136 IP lamp-s-1vcpu-1gb-tor1-01.ssh > CPEf81d0fa0c6a3-CMf81d0fa0c6a0.cpe.net.fido.ca.61769: Flags [P.], seq 19656:19908, ack 37, win 1452, options [nop,nop,TS val 2054136393 ecr 410549982], length 252
13:22:49.965169 IP CPEf81d0fa0c6a3-CMf81d0fa0c6a0.cpe.net.fido.ca.61769 > lamp-s-1vcpu-1gb-tor1-01.ssh: Flags [.], ack 9684, win 32763, options [nop,nop,TS val 410549982 ecr 2054136364], length 0
13:22:49.965181 IP CPEf81d0fa0c6a3-CMf81d0fa0c6a0.cpe.net.fido.ca.61769 > lamp-s-1vcpu-1gb-tor1-01.ssh: Flags [.], ack 12504, win 32723, options [nop,nop,TS val 410549982 ecr 2054136365], length 0
13:22:49.965190 IP CPEf81d0fa0c6a3-CMf81d0fa0c6a0.cpe.net.fido.ca.61769 > lamp-s-1vcpu-1gb-tor1-01.ssh: Flags [.], ack 13008, win 32760, options [nop,nop,TS val 410549983 ecr 2054136366], length 0
13:22:49.965196 IP CPEf81d0fa0c6a3-CMf81d0fa0c6a0.cpe.net.fido.ca.61769 > lamp-s-1vcpu-1gb-tor1-01.ssh: Flags [.], ack 14520, win 32752, options [nop,nop,TS val 410549983 ecr 2054136366], length 0
13:22:49.965204 IP CPEf81d0fa0c6a3-CMf81d0fa0c6a0.cpe.net.fido.ca.61769 > lamp-s-1vcpu-1gb-tor1-01.ssh: Flags [.], ack 15024, win 32760, options [nop,nop,TS val 410549985 ecr 2054136367], length 0
13:22:49.965575 IP lamp-s-1vcpu-1gb-tor1-01.ssh > CPEf81d0fa0c6a3-CMf81d0fa0c6a0.cpe.net.fido.ca.61769: Flags [P.], seq 19908:21344, ack 37, win 1452, options [nop,nop,TS val 2054136393 ecr 410549985], length 1436
13:22:49.965716 IP lamp-s-1vcpu-1gb-tor1-01.ssh > CPEf81d0fa0c6a3-CMf81d0fa0c6a0.cpe.net.fido.ca.61769: Flags [P.], seq 21344:21596, ack 37, win 1452, options [nop,nop,TS val 2054136393 ecr 410549985], length 252
13:22:49.965842 IP lamp-s-1vcpu-1gb-tor1-01.ssh > CPEf81d0fa0c6a3-CMf81d0fa0c6a0.cpe.net.fido.ca.61769: Flags [P.], seq 21596:21848, ack 37, win 1452, options [nop,nop,TS val 2054136393 ecr 410549985], length 252
13:22:49.965957 IP lamp-s-1vcpu-1gb-tor1-01.ssh > CPEf81d0fa0c6a3-CMf81d0fa0c6a0.cpe.net.fido.ca.61769: Flags [P.], seq 21848:22100, ack 37, win 1452, options [nop,nop,TS val 2054136393 ecr 410549985], length 252
13:22:49.966070 IP lamp-s-1vcpu-1gb-tor1-01.ssh > CPEf81d0fa0c6a3-CMf81d0fa0c6a0.cpe.net.fido.ca.61769: Flags [P.], seq 22100:22352, ack 37, win 1452, options [nop,nop,TS val 2054136393 ecr 410549985], length 252
13:22:49.966181 IP lamp-s-1vcpu-1gb-tor1-01.ssh > CPEf81d0fa0c6a3-CMf81d0fa0c6a0.cpe.net.fido.ca.61769: Flags [P.], seq 22352:22604, ack 37, win 1452, options [nop,nop,TS val 2054136394 ecr 410549985], length 252
13:22:49.966291 IP lamp-s-1vcpu-1gb-tor1-01.ssh > CPEf81d0fa0c6a3-CMf81d0fa0c6a0.cpe.net.fido.ca.61769: Flags [P.], seq 22604:22856, ack 37, win 1452, options [nop,nop,TS val 2054136394 ecr 410549985], length 252
13:22:49.966401 IP lamp-s-1vcpu-1gb-tor1-01.ssh > CPEf81d0fa0c6a3-CMf81d0fa0c6a0.cpe.net.fido.ca.61769: Flags [P.], seq 22856:23108, ack 37, win 1452, options [nop,nop,TS val 2054136394 ecr 410549985], length 252
13:22:49.966511 IP lamp-s-1vcpu-1gb-tor1-01.ssh > CPEf81d0fa0c6a3-CMf81d0fa0c6a0.cpe.net.fido.ca.61769: Flags [P.], seq 23108:23360, ack 37, win 1452, options [nop,nop,TS val 2054136394 ecr 410549985], length 252
13:22:49.966621 IP lamp-s-1vcpu-1gb-tor1-01.ssh > CPEf81d0fa0c6a3-CMf81d0fa0c6a0.cpe.net.fido.ca.61769: Flags [P.], seq 23360:23612, ack 37, win 1452, options [nop,nop,TS val 2054136394 ecr 410549985], length 252
13:22:49.966734 IP lamp-s-1vcpu-1gb-tor1-01.ssh > CPEf81d0fa0c6a3-CMf81d0fa0c6a0.cpe.net.fido.ca.61769: Flags [P.], seq 23612:23864, ack 37, win 1452, options [nop,nop,TS val 2054136394 ecr 410549985], length 252
13:22:49.966844 IP lamp-s-1vcpu-1gb-tor1-01.ssh > CPEf81d0fa0c6a3-CMf81d0fa0c6a0.cpe.net.fido.ca.61769: Flags [P.], seq 23864:24116, ack 37, win 1452, options [nop,nop,TS val 2054136394 ecr 410549985], length 252
13:22:49.966954 IP lamp-s-1vcpu-1gb-tor1-01.ssh > CPEf81d0fa0c6a3-CMf81d0fa0c6a0.cpe.net.fido.ca.61769: Flags [P.], seq 24116:24368, ack 37, win 1452, options [nop,nop,TS val 2054136394 ecr 410549985], length 252
13:22:49.967096 IP lamp-s-1vcpu-1gb-tor1-01.ssh > CPEf81d0fa0c6a3-CMf81d0fa0c6a0.cpe.net.fido.ca.61769: Flags [P.], seq 24368:24620, ack 37, win 1452, options [nop,nop,TS val 2054136394 ecr 410549985], length 252
13:22:49.967221 IP lamp-s-1vcpu-1gb-tor1-01.ssh > CPEf81d0fa0c6a3-CMf81d0fa0c6a0.cpe.net.fido.ca.61769: Flags [P.], seq 24620:24872, ack 37, win 1452, options [nop,nop,TS val 2054136395 ecr 410549985], length 252
13:22:49.967334 IP lamp-s-1vcpu-1gb-tor1-01.ssh > CPEf81d0fa0c6a3-CMf81d0fa0c6a0.cpe.net.fido.ca.61769: Flags [P.], seq 24872:25124, ack 37, win 1452, options [nop,nop,TS val 2054136395 ecr 410549985], length 252
13:22:49.967476 IP lamp-s-1vcpu-1gb-tor1-01.ssh > CPEf81d0fa0c6a3-CMf81d0fa0c6a0.cpe.net.fido.ca.61769: Flags [P.], seq 25124:25376, ack 37, win 1452, options [nop,nop,TS val 2054136395 ecr 410549985], length 252
13:22:49.967600 IP lamp-s-1vcpu-1gb-tor1-01.ssh > CPEf81d0fa0c6a3-CMf81d0fa0c6a0.cpe.net.fido.ca.61769: Flags [P.], seq 25376:25628, ack 37, win 1452, options [nop,nop,TS val 2054136395 ecr 410549985], length 252
13:22:49.967731 IP lamp-s-1vcpu-1gb-tor1-01.ssh > CPEf81d0fa0c6a3-CMf81d0fa0c6a0.cpe.net.fido.ca.61769: Flags [P.], seq 25628:25880, ack 37, win 1452, options [nop,nop,TS val 2054136395 ecr 410549985], length 252
13:22:49.967845 IP lamp-s-1vcpu-1gb-tor1-01.ssh > CPEf81d0fa0c6a3-CMf81d0fa0c6a0.cpe.net.fido.ca.61769: Flags [P.], seq 25880:26132, ack 37, win 1452, options [nop,nop,TS val 2054136395 ecr 410549985], length 252
13:22:49.967956 IP lamp-s-1vcpu-1gb-tor1-01.ssh > CPEf81d0fa0c6a3-CMf81d0fa0c6a0.cpe.net.fido.ca.61769: Flags [P.], seq 26132:26384, ack 37, win 1452, options [nop,nop,TS val 2054136395 ecr 410549985], length 252
13:22:49.968066 IP lamp-s-1vcpu-1gb-tor1-01.ssh > CPEf81d0fa0c6a3-CMf81d0fa0c6a0.cpe.net.fido.ca.61769: Flags [P.], seq 26384:26636, ack 37, win 1452, options [nop,nop,TS val 2054136395 ecr 410549985], length 252
13:22:49.968230 IP lamp-s-1vcpu-1gb-tor1-01.ssh > CPEf81d0fa0c6a3-CMf81d0fa0c6a0.cpe.net.fido.ca.61769: Flags [P.], seq 26636:26888, ack 37, win 1452, options [nop,nop,TS val 2054136396 ecr 410549985], length 252
13:22:49.968351 IP lamp-s-1vcpu-1gb-tor1-01.ssh > CPEf81d0fa0c6a3-CMf81d0fa0c6a0.cpe.net.fido.ca.61769: Flags [P.], seq 26888:27140, ack 37, win 1452, options [nop,nop,TS val 2054136396 ecr 410549985], length 252
13:22:49.968463 IP lamp-s-1vcpu-1gb-tor1-01.ssh > CPEf81d0fa0c6a3-CMf81d0fa0c6a0.cpe.net.fido.ca.61769: Flags [P.], seq 27140:27392, ack 37, win 1452, options [nop,nop,TS val 2054136396 ecr 410549985], length 252
13:22:49.968577 IP lamp-s-1vcpu-1gb-tor1-01.ssh > CPEf81d0fa0c6a3-CMf81d0fa0c6a0.cpe.net.fido.ca.61769: Flags [P.], seq 27392:27644, ack 37, win 1452, options [nop,nop,TS val 2054136396 ecr 410549985], length 252
13:22:49.968687 IP lamp-s-1vcpu-1gb-tor1-01.ssh > CPEf81d0fa0c6a3-CMf81d0fa0c6a0.cpe.net.fido.ca.61769: Flags [P.], seq 27644:27896, ack 37, win 1452, options [nop,nop,TS val 2054136396 ecr 410549985], length 252
13:22:49.968797 IP lamp-s-1vcpu-1gb-tor1-01.ssh > CPEf81d0fa0c6a3-CMf81d0fa0c6a0.cpe.net.fido.ca.61769: Flags [P.], seq 27896:28148, ack 37, win 1452, options [nop,nop,TS val 2054136396 ecr 410549985], length 252
13:22:49.968909 IP lamp-s-1vcpu-1gb-tor1-01.ssh > CPEf81d0fa0c6a3-CMf81d0fa0c6a0.cpe.net.fido.ca.61769: Flags [P.], seq 28148:28400, ack 37, win 1452, options [nop,nop,TS val 2054136396 ecr 410549985], length 252
13:22:49.969019 IP lamp-s-1vcpu-1gb-tor1-01.ssh > CPEf81d0fa0c6a3-CMf81d0fa0c6a0.cpe.net.fido.ca.61769: Flags [P.], seq 28400:28652, ack 37, win 1452, options [nop,nop,TS val 2054136396 ecr 410549985], length 252
13:22:49.969130 IP lamp-s-1vcpu-1gb-tor1-01.ssh > CPEf81d0fa0c6a3-CMf81d0fa0c6a0.cpe.net.fido.ca.61769: Flags [P.], seq 28652:28904, ack 37, win 1452, options [nop,nop,TS val 2054136397 ecr 410549985], length 252
13:22:49.969243 IP lamp-s-1vcpu-1gb-tor1-01.ssh > CPEf81d0fa0c6a3-CMf81d0fa0c6a0.cpe.net.fido.ca.61769: Flags [P.], seq 28904:29156, ack 37, win 1452, options [nop,nop,TS val 2054136397 ecr 410549985], length 252
13:22:49.969354 IP lamp-s-1vcpu-1gb-tor1-01.ssh > CPEf81d0fa0c6a3-CMf81d0fa0c6a0.cpe.net.fido.ca.61769: Flags [P.], seq 29156:29408, ack 37, win 1452, options [nop,nop,TS val 2054136397 ecr 410549985], length 252
13:22:49.969466 IP lamp-s-1vcpu-1gb-tor1-01.ssh > CPEf81d0fa0c6a3-CMf81d0fa0c6a0.cpe.net.fido.ca.61769: Flags [P.], seq 29408:29660, ack 37, win 1452, options [nop,nop,TS val 2054136397 ecr 410549985], length 252
13:22:49.969577 IP lamp-s-1vcpu-1gb-tor1-01.ssh > CPEf81d0fa0c6a3-CMf81d0fa0c6a0.cpe.net.fido.ca.61769: Flags [P.], seq 29660:29912, ack 37, win 1452, options [nop,nop,TS val 2054136397 ecr 410549985], length 252
13:22:49.969688 IP lamp-s-1vcpu-1gb-tor1-01.ssh > CPEf81d0fa0c6a3-CMf81d0fa0c6a0.cpe.net.fido.ca.61769: Flags [P.], seq 29912:30164, ack 37, win 1452, options [nop,nop,TS val 2054136397 ecr 410549985], length 252
13:22:49.969775 IP CPEf81d0fa0c6a3-CMf81d0fa0c6a0.cpe.net.fido.ca.61769 > lamp-s-1vcpu-1gb-tor1-01.ssh: Flags [.], ack 16632, win 32750, options [nop,nop,TS val 410550001 ecr 2054136384], length 0
13:22:49.969803 IP CPEf81d0fa0c6a3-CMf81d0fa0c6a0.cpe.net.fido.ca.61769 > lamp-s-1vcpu-1gb-tor1-01.ssh: Flags [.], ack 18144, win 32727, options [nop,nop,TS val 410550001 ecr 2054136385], length 0
13:22:49.969813 IP CPEf81d0fa0c6a3-CMf81d0fa0c6a0.cpe.net.fido.ca.61769 > lamp-s-1vcpu-1gb-tor1-01.ssh: Flags [.], ack 18648, win 32760, options [nop,nop,TS val 410550002 ecr 2054136385], length 0
13:22:49.969819 IP CPEf81d0fa0c6a3-CMf81d0fa0c6a0.cpe.net.fido.ca.61769 > lamp-s-1vcpu-1gb-tor1-01.ssh: Flags [.], ack 19656, win 32744, options [nop,nop,TS val 410550002 ecr 2054136386], length 0
13:22:49.970002 IP lamp-s-1vcpu-1gb-tor1-01.ssh > CPEf81d0fa0c6a3-CMf81d0fa0c6a0.cpe.net.fido.ca.61769: Flags [P.], seq 30164:31208, ack 37, win 1452, options [nop,nop,TS val 2054136397 ecr 410550002], length 1044
13:22:49.970128 IP lamp-s-1vcpu-1gb-tor1-01.ssh > CPEf81d0fa0c6a3-CMf81d0fa0c6a0.cpe.net.fido.ca.61769: Flags [P.], seq 31208:31460, ack 37, win 1452, options [nop,nop,TS val 2054136398 ecr 410550002], length 252
13:22:49.970239 IP lamp-s-1vcpu-1gb-tor1-01.ssh > CPEf81d0fa0c6a3-CMf81d0fa0c6a0.cpe.net.fido.ca.61769: Flags [P.], seq 31460:31712, ack 37, win 1452, options [nop,nop,TS val 2054136398 ecr 410550002], length 252
13:22:49.970351 IP lamp-s-1vcpu-1gb-tor1-01.ssh > CPEf81d0fa0c6a3-CMf81d0fa0c6a0.cpe.net.fido.ca.61769: Flags [P.], seq 31712:31964, ack 37, win 1452, options [nop,nop,TS val 2054136398 ecr 410550002], length 252
13:22:49.970463 IP lamp-s-1vcpu-1gb-tor1-01.ssh > CPEf81d0fa0c6a3-CMf81d0fa0c6a0.cpe.net.fido.ca.61769: Flags [P.], seq 31964:32216, ack 37, win 1452, options [nop,nop,TS val 2054136398 ecr 410550002], length 252
13:22:49.970640 IP lamp-s-1vcpu-1gb-tor1-01.ssh > CPEf81d0fa0c6a3-CMf81d0fa0c6a0.cpe.net.fido.ca.61769: Flags [P.], seq 32216:32468, ack 37, win 1452, options [nop,nop,TS val 2054136398 ecr 410550002], length 252
13:22:49.970819 IP lamp-s-1vcpu-1gb-tor1-01.ssh > CPEf81d0fa0c6a3-CMf81d0fa0c6a0.cpe.net.fido.ca.61769: Flags [P.], seq 32468:32720, ack 37, win 1452, options [nop,nop,TS val 2054136398 ecr 410550002], length 252
13:22:49.970997 IP lamp-s-1vcpu-1gb-tor1-01.ssh > CPEf81d0fa0c6a3-CMf81d0fa0c6a0.cpe.net.fido.ca.61769: Flags [P.], seq 32720:32972, ack 37, win 1452, options [nop,nop,TS val 2054136398 ecr 410550002], length 252
13:22:49.971123 IP lamp-s-1vcpu-1gb-tor1-01.ssh > CPEf81d0fa0c6a3-CMf81d0fa0c6a0.cpe.net.fido.ca.61769: Flags [P.], seq 32972:33224, ack 37, win 1452, options [nop,nop,TS val 2054136399 ecr 410550002], length 252
13:22:49.971237 IP lamp-s-1vcpu-1gb-tor1-01.ssh > CPEf81d0fa0c6a3-CMf81d0fa0c6a0.cpe.net.fido.ca.61769: Flags [P.], seq 33224:33476, ack 37, win 1452, options [nop,nop,TS val 2054136399 ecr 410550002], length 252
13:22:49.971350 IP lamp-s-1vcpu-1gb-tor1-01.ssh > CPEf81d0fa0c6a3-CMf81d0fa0c6a0.cpe.net.fido.ca.61769: Flags [P.], seq 33476:33728, ack 37, win 1452, options [nop,nop,TS val 2054136399 ecr 410550002], length 252
13:22:49.971491 IP lamp-s-1vcpu-1gb-tor1-01.ssh > CPEf81d0fa0c6a3-CMf81d0fa0c6a0.cpe.net.fido.ca.61769: Flags [P.], seq 33728:33980, ack 37, win 1452, options [nop,nop,TS val 2054136399 ecr 410550002], length 252
13:22:49.971608 IP lamp-s-1vcpu-1gb-tor1-01.ssh > CPEf81d0fa0c6a3-CMf81d0fa0c6a0.cpe.net.fido.ca.61769: Flags [P.], seq 33980:34232, ack 37, win 1452, options [nop,nop,TS val 2054136399 ecr 410550002], length 252
13:22:49.971722 IP lamp-s-1vcpu-1gb-tor1-01.ssh > CPEf81d0fa0c6a3-CMf81d0fa0c6a0.cpe.net.fido.ca.61769: Flags [P.], seq 34232:34484, ack 37, win 1452, options [nop,nop,TS val 2054136399 ecr 410550002], length 252
13:22:49.971833 IP lamp-s-1vcpu-1gb-tor1-01.ssh > CPEf81d0fa0c6a3-CMf81d0fa0c6a0.cpe.net.fido.ca.61769: Flags [P.], seq 34484:34736, ack 37, win 1452, options [nop,nop,TS val 2054136399 ecr 410550002], length 252
13:22:49.971945 IP lamp-s-1vcpu-1gb-tor1-01.ssh > CPEf81d0fa0c6a3-CMf81d0fa0c6a0.cpe.net.fido.ca.61769: Flags [P.], seq 34736:34988, ack 37, win 1452, options [nop,nop,TS val 2054136399 ecr 410550002], length 252
13:22:49.972058 IP lamp-s-1vcpu-1gb-tor1-01.ssh > CPEf81d0fa0c6a3-CMf81d0fa0c6a0.cpe.net.fido.ca.61769: Flags [P.], seq 34988:35240, ack 37, win 1452, options [nop,nop,TS val 2054136399 ecr 410550002], length 252
13:22:49.972216 IP lamp-s-1vcpu-1gb-tor1-01.ssh > CPEf81d0fa0c6a3-CMf81d0fa0c6a0.cpe.net.fido.ca.61769: Flags [P.], seq 35240:35492, ack 37, win 1452, options [nop,nop,TS val 2054136400 ecr 410550002], length 252
13:22:49.972334 IP lamp-s-1vcpu-1gb-tor1-01.ssh > CPEf81d0fa0c6a3-CMf81d0fa0c6a0.cpe.net.fido.ca.61769: Flags [P.], seq 35492:35744, ack 37, win 1452, options [nop,nop,TS val 2054136400 ecr 410550002], length 252
13:22:49.972449 IP lamp-s-1vcpu-1gb-tor1-01.ssh > CPEf81d0fa0c6a3-CMf81d0fa0c6a0.cpe.net.fido.ca.61769: Flags [P.], seq 35744:35996, ack 37, win 1452, options [nop,nop,TS val 2054136400 ecr 410550002], length 252
13:22:49.972560 IP lamp-s-1vcpu-1gb-tor1-01.ssh > CPEf81d0fa0c6a3-CMf81d0fa0c6a0.cpe.net.fido.ca.61769: Flags [P.], seq 35996:36248, ack 37, win 1452, options [nop,nop,TS val 2054136400 ecr 410550002], length 252
13:22:49.972677 IP lamp-s-1vcpu-1gb-tor1-01.ssh > CPEf81d0fa0c6a3-CMf81d0fa0c6a0.cpe.net.fido.ca.61769: Flags [P.], seq 36248:36500, ack 37, win 1452, options [nop,nop,TS val 2054136400 ecr 410550002], length 252
13:22:49.972789 IP lamp-s-1vcpu-1gb-tor1-01.ssh > CPEf81d0fa0c6a3-CMf81d0fa0c6a0.cpe.net.fido.ca.61769: Flags [P.], seq 36500:36752, ack 37, win 1452, options [nop,nop,TS val 2054136400 ecr 410550002], length 252
13:22:49.972902 IP lamp-s-1vcpu-1gb-tor1-01.ssh > CPEf81d0fa0c6a3-CMf81d0fa0c6a0.cpe.net.fido.ca.61769: Flags [P.], seq 36752:37004, ack 37, win 1452, options [nop,nop,TS val 2054136400 ecr 410550002], length 252
13:22:49.973014 IP lamp-s-1vcpu-1gb-tor1-01.ssh > CPEf81d0fa0c6a3-CMf81d0fa0c6a0.cpe.net.fido.ca.61769: Flags [P.], seq 37004:37256, ack 37, win 1452, options [nop,nop,TS val 2054136400 ecr 410550002], length 252
13:22:49.973129 IP lamp-s-1vcpu-1gb-tor1-01.ssh > CPEf81d0fa0c6a3-CMf81d0fa0c6a0.cpe.net.fido.ca.61769: Flags [P.], seq 37256:37508, ack 37, win 1452, options [nop,nop,TS val 2054136401 ecr 410550002], length 252
13:22:49.973246 IP lamp-s-1vcpu-1gb-tor1-01.ssh > CPEf81d0fa0c6a3-CMf81d0fa0c6a0.cpe.net.fido.ca.61769: Flags [P.], seq 37508:37760, ack 37, win 1452, options [nop,nop,TS val 2054136401 ecr 410550002], length 252
13:22:49.973359 IP lamp-s-1vcpu-1gb-tor1-01.ssh > CPEf81d0fa0c6a3-CMf81d0fa0c6a0.cpe.net.fido.ca.61769: Flags [P.], seq 37760:38012, ack 37, win 1452, options [nop,nop,TS val 2054136401 ecr 410550002], length 252
13:22:49.973473 IP lamp-s-1vcpu-1gb-tor1-01.ssh > CPEf81d0fa0c6a3-CMf81d0fa0c6a0.cpe.net.fido.ca.61769: Flags [P.], seq 38012:38264, ack 37, win 1452, options [nop,nop,TS val 2054136401 ecr 410550002], length 252
13:22:49.973600 IP lamp-s-1vcpu-1gb-tor1-01.ssh > CPEf81d0fa0c6a3-CMf81d0fa0c6a0.cpe.net.fido.ca.61769: Flags [P.], seq 38264:38516, ack 37, win 1452, options [nop,nop,TS val 2054136401 ecr 410550002], length 252
13:22:49.973712 IP lamp-s-1vcpu-1gb-tor1-01.ssh > CPEf81d0fa0c6a3-CMf81d0fa0c6a0.cpe.net.fido.ca.61769: Flags [P.], seq 38516:38768, ack 37, win 1452, options [nop,nop,TS val 2054136401 ecr 410550002], length 252
13:22:49.973824 IP lamp-s-1vcpu-1gb-tor1-01.ssh > CPEf81d0fa0c6a3-CMf81d0fa0c6a0.cpe.net.fido.ca.61769: Flags [P.], seq 38768:39020, ack 37, win 1452, options [nop,nop,TS val 2054136401 ecr 410550002], length 252
13:22:49.973937 IP lamp-s-1vcpu-1gb-tor1-01.ssh > CPEf81d0fa0c6a3-CMf81d0fa0c6a0.cpe.net.fido.ca.61769: Flags [P.], seq 39020:39272, ack 37, win 1452, options [nop,nop,TS val 2054136401 ecr 410550002], length 252
13:22:49.974049 IP lamp-s-1vcpu-1gb-tor1-01.ssh > CPEf81d0fa0c6a3-CMf81d0fa0c6a0.cpe.net.fido.ca.61769: Flags [P.], seq 39272:39524, ack 37, win 1452, options [nop,nop,TS val 2054136401 ecr 410550002], length 252
13:22:49.974161 IP lamp-s-1vcpu-1gb-tor1-01.ssh > CPEf81d0fa0c6a3-CMf81d0fa0c6a0.cpe.net.fido.ca.61769: Flags [P.], seq 39524:39776, ack 37, win 1452, options [nop,nop,TS val 2054136402 ecr 410550002], length 252
13:22:49.974281 IP lamp-s-1vcpu-1gb-tor1-01.ssh > CPEf81d0fa0c6a3-CMf81d0fa0c6a0.cpe.net.fido.ca.61769: Flags [P.], seq 39776:40028, ack 37, win 1452, options [nop,nop,TS val 2054136402 ecr 410550002], length 252
13:22:49.974396 IP lamp-s-1vcpu-1gb-tor1-01.ssh > CPEf81d0fa0c6a3-CMf81d0fa0c6a0.cpe.net.fido.ca.61769: Flags [P.], seq 40028:40280, ack 37, win 1452, options [nop,nop,TS val 2054136402 ecr 410550002], length 252
13:22:49.974513 IP lamp-s-1vcpu-1gb-tor1-01.ssh > CPEf81d0fa0c6a3-CMf81d0fa0c6a0.cpe.net.fido.ca.61769: Flags [P.], seq 40280:40532, ack 37, win 1452, options [nop,nop,TS val 2054136402 ecr 410550002], length 252
13:22:49.974625 IP lamp-s-1vcpu-1gb-tor1-01.ssh > CPEf81d0fa0c6a3-CMf81d0fa0c6a0.cpe.net.fido.ca.61769: Flags [P.], seq 40532:40784, ack 37, win 1452, options [nop,nop,TS val 2054136402 ecr 410550002], length 252
13:22:49.974738 IP lamp-s-1vcpu-1gb-tor1-01.ssh > CPEf81d0fa0c6a3-CMf81d0fa0c6a0.cpe.net.fido.ca.61769: Flags [P.], seq 40784:41036, ack 37, win 1452, options [nop,nop,TS val 2054136402 ecr 410550002], length 252
13:22:49.974850 IP lamp-s-1vcpu-1gb-tor1-01.ssh > CPEf81d0fa0c6a3-CMf81d0fa0c6a0.cpe.net.fido.ca.61769: Flags [P.], seq 41036:41288, ack 37, win 1452, options [nop,nop,TS val 2054136402 ecr 410550002], length 252
13:22:49.974961 IP lamp-s-1vcpu-1gb-tor1-01.ssh > CPEf81d0fa0c6a3-CMf81d0fa0c6a0.cpe.net.fido.ca.61769: Flags [P.], seq 41288:41540, ack 37, win 1452, options [nop,nop,TS val 2054136402 ecr 410550002], length 252
13:22:49.975072 IP lamp-s-1vcpu-1gb-tor1-01.ssh > CPEf81d0fa0c6a3-CMf81d0fa0c6a0.cpe.net.fido.ca.61769: Flags [P.], seq 41540:41792, ack 37, win 1452, options [nop,nop,TS val 2054136402 ecr 410550002], length 252
13:22:49.975185 IP lamp-s-1vcpu-1gb-tor1-01.ssh > CPEf81d0fa0c6a3-CMf81d0fa0c6a0.cpe.net.fido.ca.61769: Flags [P.], seq 41792:42044, ack 37, win 1452, options [nop,nop,TS val 2054136403 ecr 410550002], length 252
13:22:49.975354 IP lamp-s-1vcpu-1gb-tor1-01.ssh > CPEf81d0fa0c6a3-CMf81d0fa0c6a0.cpe.net.fido.ca.61769: Flags [P.], seq 42044:42296, ack 37, win 1452, options [nop,nop,TS val 2054136403 ecr 410550002], length 252
13:22:49.975518 IP lamp-s-1vcpu-1gb-tor1-01.ssh > CPEf81d0fa0c6a3-CMf81d0fa0c6a0.cpe.net.fido.ca.61769: Flags [P.], seq 42296:42548, ack 37, win 1452, options [nop,nop,TS val 2054136403 ecr 410550002], length 252
13:22:49.975641 IP lamp-s-1vcpu-1gb-tor1-01.ssh > CPEf81d0fa0c6a3-CMf81d0fa0c6a0.cpe.net.fido.ca.61769: Flags [P.], seq 42548:42800, ack 37, win 1452, options [nop,nop,TS val 2054136403 ecr 410550002], length 252
13:22:49.975756 IP lamp-s-1vcpu-1gb-tor1-01.ssh > CPEf81d0fa0c6a3-CMf81d0fa0c6a0.cpe.net.fido.ca.61769: Flags [P.], seq 42800:43052, ack 37, win 1452, options [nop,nop,TS val 2054136403 ecr 410550002], length 252
13:22:49.975888 IP lamp-s-1vcpu-1gb-tor1-01.ssh > CPEf81d0fa0c6a3-CMf81d0fa0c6a0.cpe.net.fido.ca.61769: Flags [P.], seq 43052:43304, ack 37, win 1452, options [nop,nop,TS val 2054136403 ecr 410550002], length 252
13:22:49.976031 IP lamp-s-1vcpu-1gb-tor1-01.ssh > CPEf81d0fa0c6a3-CMf81d0fa0c6a0.cpe.net.fido.ca.61769: Flags [P.], seq 43304:43556, ack 37, win 1452, options [nop,nop,TS val 2054136403 ecr 410550002], length 252
13:22:49.976243 IP lamp-s-1vcpu-1gb-tor1-01.ssh > CPEf81d0fa0c6a3-CMf81d0fa0c6a0.cpe.net.fido.ca.61769: Flags [P.], seq 43556:43808, ack 37, win 1452, options [nop,nop,TS val 2054136404 ecr 410550002], length 252
13:22:49.976406 IP lamp-s-1vcpu-1gb-tor1-01.ssh > CPEf81d0fa0c6a3-CMf81d0fa0c6a0.cpe.net.fido.ca.61769: Flags [P.], seq 43808:44060, ack 37, win 1452, options [nop,nop,TS val 2054136404 ecr 410550002], length 252
13:22:49.976572 IP lamp-s-1vcpu-1gb-tor1-01.ssh > CPEf81d0fa0c6a3-CMf81d0fa0c6a0.cpe.net.fido.ca.61769: Flags [P.], seq 44060:44312, ack 37, win 1452, options [nop,nop,TS val 2054136404 ecr 410550002], length 252
13:22:49.976729 IP lamp-s-1vcpu-1gb-tor1-01.ssh > CPEf81d0fa0c6a3-CMf81d0fa0c6a0.cpe.net.fido.ca.61769: Flags [P.], seq 44312:44564, ack 37, win 1452, options [nop,nop,TS val 2054136404 ecr 410550002], length 252
13:22:49.977019 IP lamp-s-1vcpu-1gb-tor1-01.ssh > CPEf81d0fa0c6a3-CMf81d0fa0c6a0.cpe.net.fido.ca.61769: Flags [P.], seq 44564:44816, ack 37, win 1452, options [nop,nop,TS val 2054136404 ecr 410550002], length 252
13:22:49.977175 IP lamp-s-1vcpu-1gb-tor1-01.ssh > CPEf81d0fa0c6a3-CMf81d0fa0c6a0.cpe.net.fido.ca.61769: Flags [P.], seq 44816:45068, ack 37, win 1452, options [nop,nop,TS val 2054136405 ecr 410550002], length 252
13:22:49.977297 IP lamp-s-1vcpu-1gb-tor1-01.ssh > CPEf81d0fa0c6a3-CMf81d0fa0c6a0.cpe.net.fido.ca.61769: Flags [P.], seq 45068:45320, ack 37, win 1452, options [nop,nop,TS val 2054136405 ecr 410550002], length 252
13:22:49.983208 IP CPEf81d0fa0c6a3-CMf81d0fa0c6a0.cpe.net.fido.ca.61769 > lamp-s-1vcpu-1gb-tor1-01.ssh: Flags [.], ack 19908, win 32764, options [nop,nop,TS val 410550009 ecr 2054136393], length 0
13:22:49.983279 IP lamp-s-1vcpu-1gb-tor1-01.ssh > CPEf81d0fa0c6a3-CMf81d0fa0c6a0.cpe.net.fido.ca.61769: Flags [P.], seq 45320:45572, ack 37, win 1452, options [nop,nop,TS val 2054136411 ecr 410550009], length 252
13:22:49.983312 IP CPEf81d0fa0c6a3-CMf81d0fa0c6a0.cpe.net.fido.ca.61769 > lamp-s-1vcpu-1gb-tor1-01.ssh: Flags [.], ack 21596, win 32741, options [nop,nop,TS val 410550010 ecr 2054136393], length 0
13:22:49.983323 IP CPEf81d0fa0c6a3-CMf81d0fa0c6a0.cpe.net.fido.ca.61769 > lamp-s-1vcpu-1gb-tor1-01.ssh: Flags [.], ack 24116, win 32728, options [nop,nop,TS val 410550010 ecr 2054136394], length 0
13:22:49.983336 IP CPEf81d0fa0c6a3-CMf81d0fa0c6a0.cpe.net.fido.ca.61769 > lamp-s-1vcpu-1gb-tor1-01.ssh: Flags [.], ack 25124, win 32712, options [nop,nop,TS val 410550010 ecr 2054136395], length 0
13:22:49.983344 IP CPEf81d0fa0c6a3-CMf81d0fa0c6a0.cpe.net.fido.ca.61769 > lamp-s-1vcpu-1gb-tor1-01.ssh: Flags [.], ack 25124, win 32768, options [nop,nop,TS val 410550010 ecr 2054136395], length 0
13:22:49.983731 IP lamp-s-1vcpu-1gb-tor1-01.ssh > CPEf81d0fa0c6a3-CMf81d0fa0c6a0.cpe.net.fido.ca.61769: Flags [P.], seq 45572:46816, ack 37, win 1452, options [nop,nop,TS val 2054136411 ecr 410550010], length 1244
13:22:49.983882 IP lamp-s-1vcpu-1gb-tor1-01.ssh > CPEf81d0fa0c6a3-CMf81d0fa0c6a0.cpe.net.fido.ca.61769: Flags [P.], seq 46816:47068, ack 37, win 1452, options [nop,nop,TS val 2054136411 ecr 410550010], length 252
13:22:49.984062 IP lamp-s-1vcpu-1gb-tor1-01.ssh > CPEf81d0fa0c6a3-CMf81d0fa0c6a0.cpe.net.fido.ca.61769: Flags [P.], seq 47068:47320, ack 37, win 1452, options [nop,nop,TS val 2054136411 ecr 410550010], length 252
