root@lamp-s-1vcpu-1gb-tor1-01:~# tcpdump -i eth0 tcp
tcpdump: verbose output suppressed, use -v or -vv for full protocol decode
listening on eth0, link-type EN10MB (Ethernet), capture size 262144 bytes
13:38:08.694409 IP lamp-s-1vcpu-1gb-tor1-01.ssh > CPEf81d0fa0c6a3-CMf81d0fa0c6a0.cpe.net.fido.ca.61941: Flags [P.], seq 2375636987:2375637095, ack 3056384988, win 859, options [nop,nop,TS val 2055055117 ecr 411459281], length 108
13:38:08.694551 IP lamp-s-1vcpu-1gb-tor1-01.ssh > CPEf81d0fa0c6a3-CMf81d0fa0c6a0.cpe.net.fido.ca.61941: Flags [P.], seq 108:144, ack 1, win 859, options [nop,nop,TS val 2055055117 ecr 411459281], length 36
13:38:08.694679 IP lamp-s-1vcpu-1gb-tor1-01.ssh > CPEf81d0fa0c6a3-CMf81d0fa0c6a0.cpe.net.fido.ca.61941: Flags [P.], seq 144:252, ack 1, win 859, options [nop,nop,TS val 2055055117 ecr 411459281], length 108
13:38:08.694781 IP lamp-s-1vcpu-1gb-tor1-01.ssh > CPEf81d0fa0c6a3-CMf81d0fa0c6a0.cpe.net.fido.ca.61941: Flags [P.], seq 252:288, ack 1, win 859, options [nop,nop,TS val 2055055117 ecr 411459281], length 36
13:38:08.701809 IP lamp-s-1vcpu-1gb-tor1-01.ssh > CPEf81d0fa0c6a3-CMf81d0fa0c6a0.cpe.net.fido.ca.61941: Flags [P.], seq 288:556, ack 1, win 859, options [nop,nop,TS val 2055055124 ecr 411459281], length 268
13:38:08.701944 IP lamp-s-1vcpu-1gb-tor1-01.ssh > CPEf81d0fa0c6a3-CMf81d0fa0c6a0.cpe.net.fido.ca.61941: Flags [P.], seq 556:592, ack 1, win 859, options [nop,nop,TS val 2055055124 ecr 411459281], length 36
13:38:08.702090 IP lamp-s-1vcpu-1gb-tor1-01.ssh > CPEf81d0fa0c6a3-CMf81d0fa0c6a0.cpe.net.fido.ca.61941: Flags [P.], seq 592:836, ack 1, win 859, options [nop,nop,TS val 2055055124 ecr 411459281], length 244
13:38:08.702190 IP lamp-s-1vcpu-1gb-tor1-01.ssh > CPEf81d0fa0c6a3-CMf81d0fa0c6a0.cpe.net.fido.ca.61941: Flags [P.], seq 836:872, ack 1, win 859, options [nop,nop,TS val 2055055125 ecr 411459281], length 36
13:38:08.702320 IP lamp-s-1vcpu-1gb-tor1-01.ssh > CPEf81d0fa0c6a3-CMf81d0fa0c6a0.cpe.net.fido.ca.61941: Flags [P.], seq 872:1116, ack 1, win 859, options [nop,nop,TS val 2055055125 ecr 411459281], length 244
13:38:08.709124 IP CPEf81d0fa0c6a3-CMf81d0fa0c6a0.cpe.net.fido.ca.61941 > lamp-s-1vcpu-1gb-tor1-01.ssh: Flags [.], ack 0, win 32767, options [nop,nop,TS val 411459300 ecr 2055055107], length 0
13:38:08.709199 IP lamp-s-1vcpu-1gb-tor1-01.ssh > CPEf81d0fa0c6a3-CMf81d0fa0c6a0.cpe.net.fido.ca.61941: Flags [P.], seq 1116:2832, ack 1, win 859, options [nop,nop,TS val 2055055132 ecr 411459300], length 1716
13:38:08.714858 IP CPEf81d0fa0c6a3-CMf81d0fa0c6a0.cpe.net.fido.ca.61941 > lamp-s-1vcpu-1gb-tor1-01.ssh: Flags [.], ack 144, win 32765, options [nop,nop,TS val 411459310 ecr 2055055117], length 0
13:38:08.714924 IP lamp-s-1vcpu-1gb-tor1-01.ssh > CPEf81d0fa0c6a3-CMf81d0fa0c6a0.cpe.net.fido.ca.61941: Flags [P.], seq 2832:3376, ack 1, win 859, options [nop,nop,TS val 2055055137 ecr 411459310], length 544
13:38:08.714952 IP CPEf81d0fa0c6a3-CMf81d0fa0c6a0.cpe.net.fido.ca.61941 > lamp-s-1vcpu-1gb-tor1-01.ssh: Flags [.], ack 288, win 32763, options [nop,nop,TS val 411459310 ecr 2055055117], length 0
13:38:08.714962 IP CPEf81d0fa0c6a3-CMf81d0fa0c6a0.cpe.net.fido.ca.61941 > lamp-s-1vcpu-1gb-tor1-01.ssh: Flags [.], ack 592, win 32763, options [nop,nop,TS val 411459316 ecr 2055055124], length 0
13:38:08.714970 IP CPEf81d0fa0c6a3-CMf81d0fa0c6a0.cpe.net.fido.ca.61941 > lamp-s-1vcpu-1gb-tor1-01.ssh: Flags [.], ack 1116, win 32755, options [nop,nop,TS val 411459316 ecr 2055055125], length 0
13:38:08.715202 IP lamp-s-1vcpu-1gb-tor1-01.ssh > CPEf81d0fa0c6a3-CMf81d0fa0c6a0.cpe.net.fido.ca.61941: Flags [P.], seq 3376:3604, ack 1, win 859, options [nop,nop,TS val 2055055138 ecr 411459316], length 228
13:38:08.715295 IP lamp-s-1vcpu-1gb-tor1-01.ssh > CPEf81d0fa0c6a3-CMf81d0fa0c6a0.cpe.net.fido.ca.61941: Flags [P.], seq 3604:3640, ack 1, win 859, options [nop,nop,TS val 2055055138 ecr 411459316], length 36
13:38:08.715414 IP lamp-s-1vcpu-1gb-tor1-01.ssh > CPEf81d0fa0c6a3-CMf81d0fa0c6a0.cpe.net.fido.ca.61941: Flags [P.], seq 3640:3884, ack 1, win 859, options [nop,nop,TS val 2055055138 ecr 411459316], length 244
13:38:08.715609 IP lamp-s-1vcpu-1gb-tor1-01.ssh > CPEf81d0fa0c6a3-CMf81d0fa0c6a0.cpe.net.fido.ca.61941: Flags [P.], seq 3920:4148, ack 1, win 859, options [nop,nop,TS val 2055055138 ecr 411459316], length 228
13:38:08.715789 IP lamp-s-1vcpu-1gb-tor1-01.ssh > CPEf81d0fa0c6a3-CMf81d0fa0c6a0.cpe.net.fido.ca.61941: Flags [P.], seq 4184:4412, ack 1, win 859, options [nop,nop,TS val 2055055138 ecr 411459316], length 228
13:38:08.715968 IP lamp-s-1vcpu-1gb-tor1-01.ssh > CPEf81d0fa0c6a3-CMf81d0fa0c6a0.cpe.net.fido.ca.61941: Flags [P.], seq 4448:4684, ack 1, win 859, options [nop,nop,TS val 2055055138 ecr 411459316], length 236
13:38:08.716189 IP lamp-s-1vcpu-1gb-tor1-01.ssh > CPEf81d0fa0c6a3-CMf81d0fa0c6a0.cpe.net.fido.ca.61941: Flags [P.], seq 4720:4964, ack 1, win 859, options [nop,nop,TS val 2055055139 ecr 411459316], length 244
13:38:08.716375 IP lamp-s-1vcpu-1gb-tor1-01.ssh > CPEf81d0fa0c6a3-CMf81d0fa0c6a0.cpe.net.fido.ca.61941: Flags [P.], seq 5000:5244, ack 1, win 859, options [nop,nop,TS val 2055055139 ecr 411459316], length 244
13:38:08.716554 IP lamp-s-1vcpu-1gb-tor1-01.ssh > CPEf81d0fa0c6a3-CMf81d0fa0c6a0.cpe.net.fido.ca.61941: Flags [P.], seq 5280:5524, ack 1, win 859, options [nop,nop,TS val 2055055139 ecr 411459316], length 244
13:38:08.716756 IP lamp-s-1vcpu-1gb-tor1-01.ssh > CPEf81d0fa0c6a3-CMf81d0fa0c6a0.cpe.net.fido.ca.61941: Flags [P.], seq 5560:5804, ack 1, win 859, options [nop,nop,TS val 2055055139 ecr 411459316], length 244
13:38:08.727919 IP CPEf81d0fa0c6a3-CMf81d0fa0c6a0.cpe.net.fido.ca.61941 > lamp-s-1vcpu-1gb-tor1-01.ssh: Flags [.], ack 2832, win 32741, options [nop,nop,TS val 411459323 ecr 2055055132], length 0
13:38:08.728007 IP lamp-s-1vcpu-1gb-tor1-01.ssh > CPEf81d0fa0c6a3-CMf81d0fa0c6a0.cpe.net.fido.ca.61941: Flags [P.], seq 5804:7520, ack 1, win 859, options [nop,nop,TS val 2055055150 ecr 411459323], length 1716
13:38:08.728342 IP lamp-s-1vcpu-1gb-tor1-01.ssh > CPEf81d0fa0c6a3-CMf81d0fa0c6a0.cpe.net.fido.ca.61941: Flags [P.], seq 7520:7756, ack 1, win 859, options [nop,nop,TS val 2055055151 ecr 411459323], length 236
13:38:08.728503 IP lamp-s-1vcpu-1gb-tor1-01.ssh > CPEf81d0fa0c6a3-CMf81d0fa0c6a0.cpe.net.fido.ca.61941: Flags [P.], seq 7756:7792, ack 1, win 859, options [nop,nop,TS val 2055055151 ecr 411459323], length 36
13:38:08.731973 IP CPEf81d0fa0c6a3-CMf81d0fa0c6a0.cpe.net.fido.ca.61941 > lamp-s-1vcpu-1gb-tor1-01.ssh: Flags [.], ack 3604, win 32755, options [nop,nop,TS val 411459329 ecr 2055055138], length 0
13:38:08.732015 IP lamp-s-1vcpu-1gb-tor1-01.ssh > CPEf81d0fa0c6a3-CMf81d0fa0c6a0.cpe.net.fido.ca.61941: Flags [P.], seq 7792:8632, ack 1, win 859, options [nop,nop,TS val 2055055154 ecr 411459329], length 840
13:38:08.732035 IP CPEf81d0fa0c6a3-CMf81d0fa0c6a0.cpe.net.fido.ca.61941 > lamp-s-1vcpu-1gb-tor1-01.ssh: Flags [.], ack 4964, win 32734, options [nop,nop,TS val 411459329 ecr 2055055139], length 0
13:38:08.732050 IP CPEf81d0fa0c6a3-CMf81d0fa0c6a0.cpe.net.fido.ca.61941 > lamp-s-1vcpu-1gb-tor1-01.ssh: Flags [.], ack 5804, win 32764, options [nop,nop,TS val 411459329 ecr 2055055139], length 0
13:38:08.732222 IP lamp-s-1vcpu-1gb-tor1-01.ssh > CPEf81d0fa0c6a3-CMf81d0fa0c6a0.cpe.net.fido.ca.61941: Flags [P.], seq 8632:8868, ack 1, win 859, options [nop,nop,TS val 2055055155 ecr 411459329], length 236
13:38:08.732316 IP lamp-s-1vcpu-1gb-tor1-01.ssh > CPEf81d0fa0c6a3-CMf81d0fa0c6a0.cpe.net.fido.ca.61941: Flags [P.], seq 8868:8904, ack 1, win 859, options [nop,nop,TS val 2055055155 ecr 411459329], length 36
13:38:08.732430 IP lamp-s-1vcpu-1gb-tor1-01.ssh > CPEf81d0fa0c6a3-CMf81d0fa0c6a0.cpe.net.fido.ca.61941: Flags [P.], seq 8904:9148, ack 1, win 859, options [nop,nop,TS val 2055055155 ecr 411459329], length 244
13:38:08.732509 IP lamp-s-1vcpu-1gb-tor1-01.ssh > CPEf81d0fa0c6a3-CMf81d0fa0c6a0.cpe.net.fido.ca.61941: Flags [P.], seq 9148:9184, ack 1, win 859, options [nop,nop,TS val 2055055155 ecr 411459329], length 36
13:38:08.732614 IP lamp-s-1vcpu-1gb-tor1-01.ssh > CPEf81d0fa0c6a3-CMf81d0fa0c6a0.cpe.net.fido.ca.61941: Flags [P.], seq 9184:9420, ack 1, win 859, options [nop,nop,TS val 2055055155 ecr 411459329], length 236
13:38:08.732889 IP lamp-s-1vcpu-1gb-tor1-01.ssh > CPEf81d0fa0c6a3-CMf81d0fa0c6a0.cpe.net.fido.ca.61941: Flags [P.], seq 9456:9692, ack 1, win 859, options [nop,nop,TS val 2055055155 ecr 411459329], length 236
13:38:08.733138 IP lamp-s-1vcpu-1gb-tor1-01.ssh > CPEf81d0fa0c6a3-CMf81d0fa0c6a0.cpe.net.fido.ca.61941: Flags [P.], seq 9728:9972, ack 1, win 859, options [nop,nop,TS val 2055055156 ecr 411459329], length 244
13:38:08.733323 IP lamp-s-1vcpu-1gb-tor1-01.ssh > CPEf81d0fa0c6a3-CMf81d0fa0c6a0.cpe.net.fido.ca.61941: Flags [P.], seq 10008:10252, ack 1, win 859, options [nop,nop,TS val 2055055156 ecr 411459329], length 244
13:38:08.733641 IP lamp-s-1vcpu-1gb-tor1-01.ssh > CPEf81d0fa0c6a3-CMf81d0fa0c6a0.cpe.net.fido.ca.61941: Flags [P.], seq 10288:10532, ack 1, win 859, options [nop,nop,TS val 2055055156 ecr 411459329], length 244
13:38:08.733964 IP lamp-s-1vcpu-1gb-tor1-01.ssh > CPEf81d0fa0c6a3-CMf81d0fa0c6a0.cpe.net.fido.ca.61941: Flags [P.], seq 10568:10812, ack 1, win 859, options [nop,nop,TS val 2055055156 ecr 411459329], length 244
13:38:08.734264 IP lamp-s-1vcpu-1gb-tor1-01.ssh > CPEf81d0fa0c6a3-CMf81d0fa0c6a0.cpe.net.fido.ca.61941: Flags [P.], seq 10848:11092, ack 1, win 859, options [nop,nop,TS val 2055055157 ecr 411459329], length 244
13:38:08.734618 IP lamp-s-1vcpu-1gb-tor1-01.ssh > CPEf81d0fa0c6a3-CMf81d0fa0c6a0.cpe.net.fido.ca.61941: Flags [P.], seq 11128:11580, ack 1, win 859, options [nop,nop,TS val 2055055157 ecr 411459329], length 452
13:38:08.734932 IP lamp-s-1vcpu-1gb-tor1-01.ssh > CPEf81d0fa0c6a3-CMf81d0fa0c6a0.cpe.net.fido.ca.61941: Flags [P.], seq 11580:12464, ack 1, win 859, options [nop,nop,TS val 2055055157 ecr 411459329], length 884
13:38:08.735227 IP lamp-s-1vcpu-1gb-tor1-01.ssh > CPEf81d0fa0c6a3-CMf81d0fa0c6a0.cpe.net.fido.ca.61941: Flags [P.], seq 12464:12924, ack 1, win 859, options [nop,nop,TS val 2055055158 ecr 411459329], length 460
13:38:08.735437 IP lamp-s-1vcpu-1gb-tor1-01.ssh > CPEf81d0fa0c6a3-CMf81d0fa0c6a0.cpe.net.fido.ca.61941: Flags [P.], seq 12924:13176, ack 1, win 859, options [nop,nop,TS val 2055055158 ecr 411459329], length 252
13:38:08.735651 IP lamp-s-1vcpu-1gb-tor1-01.ssh > CPEf81d0fa0c6a3-CMf81d0fa0c6a0.cpe.net.fido.ca.61941: Flags [P.], seq 13176:13428, ack 1, win 859, options [nop,nop,TS val 2055055158 ecr 411459329], length 252
13:38:08.735816 IP lamp-s-1vcpu-1gb-tor1-01.ssh > CPEf81d0fa0c6a3-CMf81d0fa0c6a0.cpe.net.fido.ca.61941: Flags [P.], seq 13428:13680, ack 1, win 859, options [nop,nop,TS val 2055055158 ecr 411459329], length 252
13:38:08.735939 IP lamp-s-1vcpu-1gb-tor1-01.ssh > CPEf81d0fa0c6a3-CMf81d0fa0c6a0.cpe.net.fido.ca.61941: Flags [P.], seq 13680:13932, ack 1, win 859, options [nop,nop,TS val 2055055158 ecr 411459329], length 252
13:38:08.736055 IP lamp-s-1vcpu-1gb-tor1-01.ssh > CPEf81d0fa0c6a3-CMf81d0fa0c6a0.cpe.net.fido.ca.61941: Flags [P.], seq 13932:14184, ack 1, win 859, options [nop,nop,TS val 2055055158 ecr 411459329], length 252
13:38:08.736215 IP lamp-s-1vcpu-1gb-tor1-01.ssh > CPEf81d0fa0c6a3-CMf81d0fa0c6a0.cpe.net.fido.ca.61941: Flags [P.], seq 14184:14436, ack 1, win 859, options [nop,nop,TS val 2055055159 ecr 411459329], length 252
13:38:08.736337 IP lamp-s-1vcpu-1gb-tor1-01.ssh > CPEf81d0fa0c6a3-CMf81d0fa0c6a0.cpe.net.fido.ca.61941: Flags [P.], seq 14436:14688, ack 1, win 859, options [nop,nop,TS val 2055055159 ecr 411459329], length 252
13:38:08.736453 IP lamp-s-1vcpu-1gb-tor1-01.ssh > CPEf81d0fa0c6a3-CMf81d0fa0c6a0.cpe.net.fido.ca.61941: Flags [P.], seq 14688:14940, ack 1, win 859, options [nop,nop,TS val 2055055159 ecr 411459329], length 252
13:38:08.736570 IP lamp-s-1vcpu-1gb-tor1-01.ssh > CPEf81d0fa0c6a3-CMf81d0fa0c6a0.cpe.net.fido.ca.61941: Flags [P.], seq 14940:15192, ack 1, win 859, options [nop,nop,TS val 2055055159 ecr 411459329], length 252
13:38:08.736686 IP lamp-s-1vcpu-1gb-tor1-01.ssh > CPEf81d0fa0c6a3-CMf81d0fa0c6a0.cpe.net.fido.ca.61941: Flags [P.], seq 15192:15444, ack 1, win 859, options [nop,nop,TS val 2055055159 ecr 411459329], length 252
13:38:08.736801 IP lamp-s-1vcpu-1gb-tor1-01.ssh > CPEf81d0fa0c6a3-CMf81d0fa0c6a0.cpe.net.fido.ca.61941: Flags [P.], seq 15444:15696, ack 1, win 859, options [nop,nop,TS val 2055055159 ecr 411459329], length 252
13:38:08.736915 IP lamp-s-1vcpu-1gb-tor1-01.ssh > CPEf81d0fa0c6a3-CMf81d0fa0c6a0.cpe.net.fido.ca.61941: Flags [P.], seq 15696:15948, ack 1, win 859, options [nop,nop,TS val 2055055159 ecr 411459329], length 252
13:38:08.737052 IP lamp-s-1vcpu-1gb-tor1-01.ssh > CPEf81d0fa0c6a3-CMf81d0fa0c6a0.cpe.net.fido.ca.61941: Flags [P.], seq 15948:16200, ack 1, win 859, options [nop,nop,TS val 2055055159 ecr 411459329], length 252
13:38:08.737168 IP lamp-s-1vcpu-1gb-tor1-01.ssh > CPEf81d0fa0c6a3-CMf81d0fa0c6a0.cpe.net.fido.ca.61941: Flags [P.], seq 16200:16452, ack 1, win 859, options [nop,nop,TS val 2055055160 ecr 411459329], length 252
13:38:08.741553 IP CPEf81d0fa0c6a3-CMf81d0fa0c6a0.cpe.net.fido.ca.61941 > lamp-s-1vcpu-1gb-tor1-01.ssh: Flags [.], ack 7520, win 32741, options [nop,nop,TS val 411459340 ecr 2055055150], length 0
13:38:08.741601 IP lamp-s-1vcpu-1gb-tor1-01.ssh > CPEf81d0fa0c6a3-CMf81d0fa0c6a0.cpe.net.fido.ca.61941: Flags [P.], seq 16452:16704, ack 1, win 859, options [nop,nop,TS val 2055055164 ecr 411459340], length 252
13:38:08.741628 IP CPEf81d0fa0c6a3-CMf81d0fa0c6a0.cpe.net.fido.ca.61941 > lamp-s-1vcpu-1gb-tor1-01.ssh: Flags [.], ack 7792, win 32763, options [nop,nop,TS val 411459341 ecr 2055055151], length 0
13:38:08.741870 IP lamp-s-1vcpu-1gb-tor1-01.ssh > CPEf81d0fa0c6a3-CMf81d0fa0c6a0.cpe.net.fido.ca.61941: Flags [P.], seq 16704:17348, ack 1, win 859, options [nop,nop,TS val 2055055164 ecr 411459341], length 644
13:38:08.742014 IP lamp-s-1vcpu-1gb-tor1-01.ssh > CPEf81d0fa0c6a3-CMf81d0fa0c6a0.cpe.net.fido.ca.61941: Flags [P.], seq 17348:17600, ack 1, win 859, options [nop,nop,TS val 2055055164 ecr 411459341], length 252
13:38:08.742150 IP lamp-s-1vcpu-1gb-tor1-01.ssh > CPEf81d0fa0c6a3-CMf81d0fa0c6a0.cpe.net.fido.ca.61941: Flags [P.], seq 17600:17852, ack 1, win 859, options [nop,nop,TS val 2055055165 ecr 411459341], length 252
13:38:08.742333 IP lamp-s-1vcpu-1gb-tor1-01.ssh > CPEf81d0fa0c6a3-CMf81d0fa0c6a0.cpe.net.fido.ca.61941: Flags [P.], seq 17852:18104, ack 1, win 859, options [nop,nop,TS val 2055055165 ecr 411459341], length 252
13:38:08.742461 IP lamp-s-1vcpu-1gb-tor1-01.ssh > CPEf81d0fa0c6a3-CMf81d0fa0c6a0.cpe.net.fido.ca.61941: Flags [P.], seq 18104:18356, ack 1, win 859, options [nop,nop,TS val 2055055165 ecr 411459341], length 252
13:38:08.742578 IP lamp-s-1vcpu-1gb-tor1-01.ssh > CPEf81d0fa0c6a3-CMf81d0fa0c6a0.cpe.net.fido.ca.61941: Flags [P.], seq 18356:18608, ack 1, win 859, options [nop,nop,TS val 2055055165 ecr 411459341], length 252
13:38:08.742696 IP lamp-s-1vcpu-1gb-tor1-01.ssh > CPEf81d0fa0c6a3-CMf81d0fa0c6a0.cpe.net.fido.ca.61941: Flags [P.], seq 18608:18860, ack 1, win 859, options [nop,nop,TS val 2055055165 ecr 411459341], length 252
13:38:08.760456 IP CPEf81d0fa0c6a3-CMf81d0fa0c6a0.cpe.net.fido.ca.61941 > lamp-s-1vcpu-1gb-tor1-01.ssh: Flags [.], ack 8868, win 32751, options [nop,nop,TS val 411459344 ecr 2055055155], length 0
13:38:08.760530 IP lamp-s-1vcpu-1gb-tor1-01.ssh > CPEf81d0fa0c6a3-CMf81d0fa0c6a0.cpe.net.fido.ca.61941: Flags [P.], seq 18860:19112, ack 1, win 859, options [nop,nop,TS val 2055055183 ecr 411459344], length 252
13:38:08.760562 IP CPEf81d0fa0c6a3-CMf81d0fa0c6a0.cpe.net.fido.ca.61941 > lamp-s-1vcpu-1gb-tor1-01.ssh: Flags [.], ack 9728, win 32767, options [nop,nop,TS val 411459344 ecr 2055055155], length 0
13:38:08.760576 IP CPEf81d0fa0c6a3-CMf81d0fa0c6a0.cpe.net.fido.ca.61941 > lamp-s-1vcpu-1gb-tor1-01.ssh: Flags [.], ack 10008, win 32763, options [nop,nop,TS val 411459345 ecr 2055055156], length 0
13:38:08.760583 IP CPEf81d0fa0c6a3-CMf81d0fa0c6a0.cpe.net.fido.ca.61941 > lamp-s-1vcpu-1gb-tor1-01.ssh: Flags [.], ack 10848, win 32759, options [nop,nop,TS val 411459345 ecr 2055055156], length 0
13:38:08.760593 IP CPEf81d0fa0c6a3-CMf81d0fa0c6a0.cpe.net.fido.ca.61941 > lamp-s-1vcpu-1gb-tor1-01.ssh: Flags [.], ack 12464, win 32742, options [nop,nop,TS val 411459345 ecr 2055055157], length 0
13:38:08.760600 IP CPEf81d0fa0c6a3-CMf81d0fa0c6a0.cpe.net.fido.ca.61941 > lamp-s-1vcpu-1gb-tor1-01.ssh: Flags [.], ack 13176, win 32756, options [nop,nop,TS val 411459346 ecr 2055055158], length 0
13:38:08.761007 IP lamp-s-1vcpu-1gb-tor1-01.ssh > CPEf81d0fa0c6a3-CMf81d0fa0c6a0.cpe.net.fido.ca.61941: Flags [P.], seq 19112:20548, ack 1, win 859, options [nop,nop,TS val 2055055183 ecr 411459346], length 1436
13:38:08.761173 IP lamp-s-1vcpu-1gb-tor1-01.ssh > CPEf81d0fa0c6a3-CMf81d0fa0c6a0.cpe.net.fido.ca.61941: Flags [P.], seq 20548:20800, ack 1, win 859, options [nop,nop,TS val 2055055184 ecr 411459346], length 252
13:38:08.761291 IP lamp-s-1vcpu-1gb-tor1-01.ssh > CPEf81d0fa0c6a3-CMf81d0fa0c6a0.cpe.net.fido.ca.61941: Flags [P.], seq 20800:21052, ack 1, win 859, options [nop,nop,TS val 2055055184 ecr 411459346], length 252
13:38:08.761422 IP lamp-s-1vcpu-1gb-tor1-01.ssh > CPEf81d0fa0c6a3-CMf81d0fa0c6a0.cpe.net.fido.ca.61941: Flags [P.], seq 21052:21304, ack 1, win 859, options [nop,nop,TS val 2055055184 ecr 411459346], length 252
13:38:08.761534 IP lamp-s-1vcpu-1gb-tor1-01.ssh > CPEf81d0fa0c6a3-CMf81d0fa0c6a0.cpe.net.fido.ca.61941: Flags [P.], seq 21304:21556, ack 1, win 859, options [nop,nop,TS val 2055055184 ecr 411459346], length 252
13:38:08.761648 IP lamp-s-1vcpu-1gb-tor1-01.ssh > CPEf81d0fa0c6a3-CMf81d0fa0c6a0.cpe.net.fido.ca.61941: Flags [P.], seq 21556:21808, ack 1, win 859, options [nop,nop,TS val 2055055184 ecr 411459346], length 252
13:38:08.761761 IP lamp-s-1vcpu-1gb-tor1-01.ssh > CPEf81d0fa0c6a3-CMf81d0fa0c6a0.cpe.net.fido.ca.61941: Flags [P.], seq 21808:22060, ack 1, win 859, options [nop,nop,TS val 2055055184 ecr 411459346], length 252
13:38:08.761874 IP lamp-s-1vcpu-1gb-tor1-01.ssh > CPEf81d0fa0c6a3-CMf81d0fa0c6a0.cpe.net.fido.ca.61941: Flags [P.], seq 22060:22312, ack 1, win 859, options [nop,nop,TS val 2055055184 ecr 411459346], length 252
13:38:08.761991 IP lamp-s-1vcpu-1gb-tor1-01.ssh > CPEf81d0fa0c6a3-CMf81d0fa0c6a0.cpe.net.fido.ca.61941: Flags [P.], seq 22312:22564, ack 1, win 859, options [nop,nop,TS val 2055055184 ecr 411459346], length 252
13:38:08.762102 IP lamp-s-1vcpu-1gb-tor1-01.ssh > CPEf81d0fa0c6a3-CMf81d0fa0c6a0.cpe.net.fido.ca.61941: Flags [P.], seq 22564:22816, ack 1, win 859, options [nop,nop,TS val 2055055184 ecr 411459346], length 252
13:38:08.762242 IP lamp-s-1vcpu-1gb-tor1-01.ssh > CPEf81d0fa0c6a3-CMf81d0fa0c6a0.cpe.net.fido.ca.61941: Flags [P.], seq 22816:23068, ack 1, win 859, options [nop,nop,TS val 2055055185 ecr 411459346], length 252
13:38:08.762432 IP lamp-s-1vcpu-1gb-tor1-01.ssh > CPEf81d0fa0c6a3-CMf81d0fa0c6a0.cpe.net.fido.ca.61941: Flags [P.], seq 23068:23320, ack 1, win 859, options [nop,nop,TS val 2055055185 ecr 411459346], length 252
13:38:08.762606 IP lamp-s-1vcpu-1gb-tor1-01.ssh > CPEf81d0fa0c6a3-CMf81d0fa0c6a0.cpe.net.fido.ca.61941: Flags [P.], seq 23320:23572, ack 1, win 859, options [nop,nop,TS val 2055055185 ecr 411459346], length 252
13:38:08.762772 IP lamp-s-1vcpu-1gb-tor1-01.ssh > CPEf81d0fa0c6a3-CMf81d0fa0c6a0.cpe.net.fido.ca.61941: Flags [P.], seq 23572:23824, ack 1, win 859, options [nop,nop,TS val 2055055185 ecr 411459346], length 252
13:38:08.762934 IP lamp-s-1vcpu-1gb-tor1-01.ssh > CPEf81d0fa0c6a3-CMf81d0fa0c6a0.cpe.net.fido.ca.61941: Flags [P.], seq 23824:24076, ack 1, win 859, options [nop,nop,TS val 2055055185 ecr 411459346], length 252
13:38:08.763096 IP lamp-s-1vcpu-1gb-tor1-01.ssh > CPEf81d0fa0c6a3-CMf81d0fa0c6a0.cpe.net.fido.ca.61941: Flags [P.], seq 24076:24328, ack 1, win 859, options [nop,nop,TS val 2055055185 ecr 411459346], length 252
13:38:08.763300 IP lamp-s-1vcpu-1gb-tor1-01.ssh > CPEf81d0fa0c6a3-CMf81d0fa0c6a0.cpe.net.fido.ca.61941: Flags [P.], seq 24328:24580, ack 1, win 859, options [nop,nop,TS val 2055055186 ecr 411459346], length 252
13:38:08.763469 IP lamp-s-1vcpu-1gb-tor1-01.ssh > CPEf81d0fa0c6a3-CMf81d0fa0c6a0.cpe.net.fido.ca.61941: Flags [P.], seq 24580:24832, ack 1, win 859, options [nop,nop,TS val 2055055186 ecr 411459346], length 252
13:38:08.763670 IP lamp-s-1vcpu-1gb-tor1-01.ssh > CPEf81d0fa0c6a3-CMf81d0fa0c6a0.cpe.net.fido.ca.61941: Flags [P.], seq 24832:25084, ack 1, win 859, options [nop,nop,TS val 2055055186 ecr 411459346], length 252
13:38:08.763839 IP lamp-s-1vcpu-1gb-tor1-01.ssh > CPEf81d0fa0c6a3-CMf81d0fa0c6a0.cpe.net.fido.ca.61941: Flags [P.], seq 25084:25336, ack 1, win 859, options [nop,nop,TS val 2055055186 ecr 411459346], length 252
13:38:08.764014 IP lamp-s-1vcpu-1gb-tor1-01.ssh > CPEf81d0fa0c6a3-CMf81d0fa0c6a0.cpe.net.fido.ca.61941: Flags [P.], seq 25336:25588, ack 1, win 859, options [nop,nop,TS val 2055055186 ecr 411459346], length 252
13:38:08.764226 IP lamp-s-1vcpu-1gb-tor1-01.ssh > CPEf81d0fa0c6a3-CMf81d0fa0c6a0.cpe.net.fido.ca.61941: Flags [P.], seq 25588:25840, ack 1, win 859, options [nop,nop,TS val 2055055187 ecr 411459346], length 252
13:38:08.764406 IP lamp-s-1vcpu-1gb-tor1-01.ssh > CPEf81d0fa0c6a3-CMf81d0fa0c6a0.cpe.net.fido.ca.61941: Flags [P.], seq 25840:26092, ack 1, win 859, options [nop,nop,TS val 2055055187 ecr 411459346], length 252
13:38:08.764542 IP lamp-s-1vcpu-1gb-tor1-01.ssh > CPEf81d0fa0c6a3-CMf81d0fa0c6a0.cpe.net.fido.ca.61941: Flags [P.], seq 26092:26344, ack 1, win 859, options [nop,nop,TS val 2055055187 ecr 411459346], length 252
13:38:08.764658 IP lamp-s-1vcpu-1gb-tor1-01.ssh > CPEf81d0fa0c6a3-CMf81d0fa0c6a0.cpe.net.fido.ca.61941: Flags [P.], seq 26344:26596, ack 1, win 859, options [nop,nop,TS val 2055055187 ecr 411459346], length 252
13:38:08.764770 IP lamp-s-1vcpu-1gb-tor1-01.ssh > CPEf81d0fa0c6a3-CMf81d0fa0c6a0.cpe.net.fido.ca.61941: Flags [P.], seq 26596:26848, ack 1, win 859, options [nop,nop,TS val 2055055187 ecr 411459346], length 252
13:38:08.764884 IP lamp-s-1vcpu-1gb-tor1-01.ssh > CPEf81d0fa0c6a3-CMf81d0fa0c6a0.cpe.net.fido.ca.61941: Flags [P.], seq 26848:27100, ack 1, win 859, options [nop,nop,TS val 2055055187 ecr 411459346], length 252
13:38:08.764996 IP lamp-s-1vcpu-1gb-tor1-01.ssh > CPEf81d0fa0c6a3-CMf81d0fa0c6a0.cpe.net.fido.ca.61941: Flags [P.], seq 27100:27352, ack 1, win 859, options [nop,nop,TS val 2055055187 ecr 411459346], length 252
13:38:08.765124 IP lamp-s-1vcpu-1gb-tor1-01.ssh > CPEf81d0fa0c6a3-CMf81d0fa0c6a0.cpe.net.fido.ca.61941: Flags [P.], seq 27352:27604, ack 1, win 859, options [nop,nop,TS val 2055055187 ecr 411459346], length 252
13:38:08.765289 IP lamp-s-1vcpu-1gb-tor1-01.ssh > CPEf81d0fa0c6a3-CMf81d0fa0c6a0.cpe.net.fido.ca.61941: Flags [P.], seq 27604:27856, ack 1, win 859, options [nop,nop,TS val 2055055188 ecr 411459346], length 252
13:38:08.765451 IP lamp-s-1vcpu-1gb-tor1-01.ssh > CPEf81d0fa0c6a3-CMf81d0fa0c6a0.cpe.net.fido.ca.61941: Flags [P.], seq 27856:28108, ack 1, win 859, options [nop,nop,TS val 2055055188 ecr 411459346], length 252
13:38:08.765613 IP lamp-s-1vcpu-1gb-tor1-01.ssh > CPEf81d0fa0c6a3-CMf81d0fa0c6a0.cpe.net.fido.ca.61941: Flags [P.], seq 28108:28360, ack 1, win 859, options [nop,nop,TS val 2055055188 ecr 411459346], length 252
13:38:08.765772 IP lamp-s-1vcpu-1gb-tor1-01.ssh > CPEf81d0fa0c6a3-CMf81d0fa0c6a0.cpe.net.fido.ca.61941: Flags [P.], seq 28360:28612, ack 1, win 859, options [nop,nop,TS val 2055055188 ecr 411459346], length 252
13:38:08.765931 IP lamp-s-1vcpu-1gb-tor1-01.ssh > CPEf81d0fa0c6a3-CMf81d0fa0c6a0.cpe.net.fido.ca.61941: Flags [P.], seq 28612:28864, ack 1, win 859, options [nop,nop,TS val 2055055188 ecr 411459346], length 252
13:38:08.766089 IP lamp-s-1vcpu-1gb-tor1-01.ssh > CPEf81d0fa0c6a3-CMf81d0fa0c6a0.cpe.net.fido.ca.61941: Flags [P.], seq 28864:29116, ack 1, win 859, options [nop,nop,TS val 2055055188 ecr 411459346], length 252
13:38:08.766249 IP lamp-s-1vcpu-1gb-tor1-01.ssh > CPEf81d0fa0c6a3-CMf81d0fa0c6a0.cpe.net.fido.ca.61941: Flags [P.], seq 29116:29368, ack 1, win 859, options [nop,nop,TS val 2055055189 ecr 411459346], length 252
13:38:08.766407 IP lamp-s-1vcpu-1gb-tor1-01.ssh > CPEf81d0fa0c6a3-CMf81d0fa0c6a0.cpe.net.fido.ca.61941: Flags [P.], seq 29368:29620, ack 1, win 859, options [nop,nop,TS val 2055055189 ecr 411459346], length 252
13:38:08.766565 IP lamp-s-1vcpu-1gb-tor1-01.ssh > CPEf81d0fa0c6a3-CMf81d0fa0c6a0.cpe.net.fido.ca.61941: Flags [P.], seq 29620:29872, ack 1, win 859, options [nop,nop,TS val 2055055189 ecr 411459346], length 252
13:38:08.766726 IP lamp-s-1vcpu-1gb-tor1-01.ssh > CPEf81d0fa0c6a3-CMf81d0fa0c6a0.cpe.net.fido.ca.61941: Flags [P.], seq 29872:30124, ack 1, win 859, options [nop,nop,TS val 2055055189 ecr 411459346], length 252
13:38:08.766898 IP lamp-s-1vcpu-1gb-tor1-01.ssh > CPEf81d0fa0c6a3-CMf81d0fa0c6a0.cpe.net.fido.ca.61941: Flags [P.], seq 30124:30376, ack 1, win 859, options [nop,nop,TS val 2055055189 ecr 411459346], length 252
13:38:08.767025 IP lamp-s-1vcpu-1gb-tor1-01.ssh > CPEf81d0fa0c6a3-CMf81d0fa0c6a0.cpe.net.fido.ca.61941: Flags [P.], seq 30376:30628, ack 1, win 859, options [nop,nop,TS val 2055055189 ecr 411459346], length 252
13:38:08.767158 IP lamp-s-1vcpu-1gb-tor1-01.ssh > CPEf81d0fa0c6a3-CMf81d0fa0c6a0.cpe.net.fido.ca.61941: Flags [P.], seq 30628:30880, ack 1, win 859, options [nop,nop,TS val 2055055190 ecr 411459346], length 252
13:38:08.767337 IP lamp-s-1vcpu-1gb-tor1-01.ssh > CPEf81d0fa0c6a3-CMf81d0fa0c6a0.cpe.net.fido.ca.61941: Flags [P.], seq 30880:31132, ack 1, win 859, options [nop,nop,TS val 2055055190 ecr 411459346], length 252
13:38:08.767476 IP lamp-s-1vcpu-1gb-tor1-01.ssh > CPEf81d0fa0c6a3-CMf81d0fa0c6a0.cpe.net.fido.ca.61941: Flags [P.], seq 31132:31384, ack 1, win 859, options [nop,nop,TS val 2055055190 ecr 411459346], length 252
13:38:08.767592 IP lamp-s-1vcpu-1gb-tor1-01.ssh > CPEf81d0fa0c6a3-CMf81d0fa0c6a0.cpe.net.fido.ca.61941: Flags [P.], seq 31384:31636, ack 1, win 859, options [nop,nop,TS val 2055055190 ecr 411459346], length 252
13:38:08.767710 IP lamp-s-1vcpu-1gb-tor1-01.ssh > CPEf81d0fa0c6a3-CMf81d0fa0c6a0.cpe.net.fido.ca.61941: Flags [P.], seq 31636:31888, ack 1, win 859, options [nop,nop,TS val 2055055190 ecr 411459346], length 252
13:38:08.767841 IP lamp-s-1vcpu-1gb-tor1-01.ssh > CPEf81d0fa0c6a3-CMf81d0fa0c6a0.cpe.net.fido.ca.61941: Flags [P.], seq 31888:32140, ack 1, win 859, options [nop,nop,TS val 2055055190 ecr 411459346], length 252
13:38:08.767957 IP lamp-s-1vcpu-1gb-tor1-01.ssh > CPEf81d0fa0c6a3-CMf81d0fa0c6a0.cpe.net.fido.ca.61941: Flags [P.], seq 32140:32392, ack 1, win 859, options [nop,nop,TS val 2055055190 ecr 411459346], length 252
13:38:08.768071 IP lamp-s-1vcpu-1gb-tor1-01.ssh > CPEf81d0fa0c6a3-CMf81d0fa0c6a0.cpe.net.fido.ca.61941: Flags [P.], seq 32392:32644, ack 1, win 859, options [nop,nop,TS val 2055055190 ecr 411459346], length 252
13:38:08.768220 IP lamp-s-1vcpu-1gb-tor1-01.ssh > CPEf81d0fa0c6a3-CMf81d0fa0c6a0.cpe.net.fido.ca.61941: Flags [P.], seq 32644:32896, ack 1, win 859, options [nop,nop,TS val 2055055191 ecr 411459346], length 252
13:38:08.768337 IP lamp-s-1vcpu-1gb-tor1-01.ssh > CPEf81d0fa0c6a3-CMf81d0fa0c6a0.cpe.net.fido.ca.61941: Flags [P.], seq 32896:33148, ack 1, win 859, options [nop,nop,TS val 2055055191 ecr 411459346], length 252
13:38:08.768449 IP lamp-s-1vcpu-1gb-tor1-01.ssh > CPEf81d0fa0c6a3-CMf81d0fa0c6a0.cpe.net.fido.ca.61941: Flags [P.], seq 33148:33400, ack 1, win 859, options [nop,nop,TS val 2055055191 ecr 411459346], length 252
13:38:08.768561 IP lamp-s-1vcpu-1gb-tor1-01.ssh > CPEf81d0fa0c6a3-CMf81d0fa0c6a0.cpe.net.fido.ca.61941: Flags [P.], seq 33400:33652, ack 1, win 859, options [nop,nop,TS val 2055055191 ecr 411459346], length 252
13:38:08.768837 IP CPEf81d0fa0c6a3-CMf81d0fa0c6a0.cpe.net.fido.ca.61941 > lamp-s-1vcpu-1gb-tor1-01.ssh: Flags [.], ack 14688, win 32760, options [nop,nop,TS val 411459347 ecr 2055055159], length 0
13:38:08.768873 IP lamp-s-1vcpu-1gb-tor1-01.ssh > CPEf81d0fa0c6a3-CMf81d0fa0c6a0.cpe.net.fido.ca.61941: Flags [P.], seq 33652:33904, ack 1, win 859, options [nop,nop,TS val 2055055191 ecr 411459347], length 252
13:38:08.768896 IP CPEf81d0fa0c6a3-CMf81d0fa0c6a0.cpe.net.fido.ca.61941 > lamp-s-1vcpu-1gb-tor1-01.ssh: Flags [.], ack 16452, win 32732, options [nop,nop,TS val 411459347 ecr 2055055160], length 0
13:38:08.768910 IP CPEf81d0fa0c6a3-CMf81d0fa0c6a0.cpe.net.fido.ca.61941 > lamp-s-1vcpu-1gb-tor1-01.ssh: Flags [.], ack 17348, win 32754, options [nop,nop,TS val 411459352 ecr 2055055164], length 0
13:38:08.768916 IP CPEf81d0fa0c6a3-CMf81d0fa0c6a0.cpe.net.fido.ca.61941 > lamp-s-1vcpu-1gb-tor1-01.ssh: Flags [.], ack 18608, win 32752, options [nop,nop,TS val 411459352 ecr 2055055165], length 0
13:38:08.768925 IP CPEf81d0fa0c6a3-CMf81d0fa0c6a0.cpe.net.fido.ca.61941 > lamp-s-1vcpu-1gb-tor1-01.ssh: Flags [.], ack 18860, win 32764, options [nop,nop,TS val 411459353 ecr 2055055165], length 0
13:38:08.769171 IP lamp-s-1vcpu-1gb-tor1-01.ssh > CPEf81d0fa0c6a3-CMf81d0fa0c6a0.cpe.net.fido.ca.61941: Flags [P.], seq 33904:35140, ack 1, win 859, options [nop,nop,TS val 2055055192 ecr 411459353], length 1236
13:38:08.769299 IP lamp-s-1vcpu-1gb-tor1-01.ssh > CPEf81d0fa0c6a3-CMf81d0fa0c6a0.cpe.net.fido.ca.61941: Flags [P.], seq 35140:35392, ack 1, win 859, options [nop,nop,TS val 2055055192 ecr 411459353], length 252
13:38:08.769416 IP lamp-s-1vcpu-1gb-tor1-01.ssh > CPEf81d0fa0c6a3-CMf81d0fa0c6a0.cpe.net.fido.ca.61941: Flags [P.], seq 35392:35644, ack 1, win 859, options [nop,nop,TS val 2055055192 ecr 411459353], length 252
13:38:08.769528 IP lamp-s-1vcpu-1gb-tor1-01.ssh > CPEf81d0fa0c6a3-CMf81d0fa0c6a0.cpe.net.fido.ca.61941: Flags [P.], seq 35644:35896, ack 1, win 859, options [nop,nop,TS val 2055055192 ecr 411459353], length 252
13:38:08.769639 IP lamp-s-1vcpu-1gb-tor1-01.ssh > CPEf81d0fa0c6a3-CMf81d0fa0c6a0.cpe.net.fido.ca.61941: Flags [P.], seq 35896:36148, ack 1, win 859, options [nop,nop,TS val 2055055192 ecr 411459353], length 252
13:38:08.769751 IP lamp-s-1vcpu-1gb-tor1-01.ssh > CPEf81d0fa0c6a3-CMf81d0fa0c6a0.cpe.net.fido.ca.61941: Flags [P.], seq 36148:36400, ack 1, win 859, options [nop,nop,TS val 2055055192 ecr 411459353], length 252
13:38:08.769862 IP lamp-s-1vcpu-1gb-tor1-01.ssh > CPEf81d0fa0c6a3-CMf81d0fa0c6a0.cpe.net.fido.ca.61941: Flags [P.], seq 36400:36652, ack 1, win 859, options [nop,nop,TS val 2055055192 ecr 411459353], length 252
13:38:08.769973 IP lamp-s-1vcpu-1gb-tor1-01.ssh > CPEf81d0fa0c6a3-CMf81d0fa0c6a0.cpe.net.fido.ca.61941: Flags [P.], seq 36652:36904, ack 1, win 859, options [nop,nop,TS val 2055055192 ecr 411459353], length 252
13:38:08.770083 IP lamp-s-1vcpu-1gb-tor1-01.ssh > CPEf81d0fa0c6a3-CMf81d0fa0c6a0.cpe.net.fido.ca.61941: Flags [P.], seq 36904:37156, ack 1, win 859, options [nop,nop,TS val 2055055192 ecr 411459353], length 252
13:38:08.770194 IP lamp-s-1vcpu-1gb-tor1-01.ssh > CPEf81d0fa0c6a3-CMf81d0fa0c6a0.cpe.net.fido.ca.61941: Flags [P.], seq 37156:37408, ack 1, win 859, options [nop,nop,TS val 2055055193 ecr 411459353], length 252
13:38:08.770304 IP lamp-s-1vcpu-1gb-tor1-01.ssh > CPEf81d0fa0c6a3-CMf81d0fa0c6a0.cpe.net.fido.ca.61941: Flags [P.], seq 37408:37660, ack 1, win 859, options [nop,nop,TS val 2055055193 ecr 411459353], length 252
13:38:08.770414 IP lamp-s-1vcpu-1gb-tor1-01.ssh > CPEf81d0fa0c6a3-CMf81d0fa0c6a0.cpe.net.fido.ca.61941: Flags [P.], seq 37660:37912, ack 1, win 859, options [nop,nop,TS val 2055055193 ecr 411459353], length 252
13:38:08.770524 IP lamp-s-1vcpu-1gb-tor1-01.ssh > CPEf81d0fa0c6a3-CMf81d0fa0c6a0.cpe.net.fido.ca.61941: Flags [P.], seq 37912:38164, ack 1, win 859, options [nop,nop,TS val 2055055193 ecr 411459353], length 252
13:38:08.770634 IP lamp-s-1vcpu-1gb-tor1-01.ssh > CPEf81d0fa0c6a3-CMf81d0fa0c6a0.cpe.net.fido.ca.61941: Flags [P.], seq 38164:38416, ack 1, win 859, options [nop,nop,TS val 2055055193 ecr 411459353], length 252
13:38:08.770745 IP lamp-s-1vcpu-1gb-tor1-01.ssh > CPEf81d0fa0c6a3-CMf81d0fa0c6a0.cpe.net.fido.ca.61941: Flags [P.], seq 38416:38668, ack 1, win 859, options [nop,nop,TS val 2055055193 ecr 411459353], length 252
13:38:08.770855 IP lamp-s-1vcpu-1gb-tor1-01.ssh > CPEf81d0fa0c6a3-CMf81d0fa0c6a0.cpe.net.fido.ca.61941: Flags [P.], seq 38668:38920, ack 1, win 859, options [nop,nop,TS val 2055055193 ecr 411459353], length 252
13:38:08.771001 IP lamp-s-1vcpu-1gb-tor1-01.ssh > CPEf81d0fa0c6a3-CMf81d0fa0c6a0.cpe.net.fido.ca.61941: Flags [P.], seq 38920:39172, ack 1, win 859, options [nop,nop,TS val 2055055193 ecr 411459353], length 252
13:38:08.776257 IP CPEf81d0fa0c6a3-CMf81d0fa0c6a0.cpe.net.fido.ca.61941 > lamp-s-1vcpu-1gb-tor1-01.ssh: Flags [.], ack 20548, win 32741, options [nop,nop,TS val 411459370 ecr 2055055183], length 0
13:38:08.776308 IP lamp-s-1vcpu-1gb-tor1-01.ssh > CPEf81d0fa0c6a3-CMf81d0fa0c6a0.cpe.net.fido.ca.61941: Flags [P.], seq 39172:39424, ack 1, win 859, options [nop,nop,TS val 2055055199 ecr 411459370], length 252
13:38:08.776341 IP CPEf81d0fa0c6a3-CMf81d0fa0c6a0.cpe.net.fido.ca.61941 > lamp-s-1vcpu-1gb-tor1-01.ssh: Flags [.], ack 21304, win 32764, options [nop,nop,TS val 411459370 ecr 2055055184], length 0
13:38:08.776359 IP CPEf81d0fa0c6a3-CMf81d0fa0c6a0.cpe.net.fido.ca.61941 > lamp-s-1vcpu-1gb-tor1-01.ssh: Flags [.], ack 22816, win 32752, options [nop,nop,TS val 411459370 ecr 2055055184], length 0
13:38:08.776374 IP CPEf81d0fa0c6a3-CMf81d0fa0c6a0.cpe.net.fido.ca.61941 > lamp-s-1vcpu-1gb-tor1-01.ssh: Flags [.], ack 23320, win 32760, options [nop,nop,TS val 411459371 ecr 2055055185], length 0
13:38:08.776383 IP CPEf81d0fa0c6a3-CMf81d0fa0c6a0.cpe.net.fido.ca.61941 > lamp-s-1vcpu-1gb-tor1-01.ssh: Flags [.], ack 24832, win 32752, options [nop,nop,TS val 411459371 ecr 2055055186], length 0
13:38:08.776668 IP lamp-s-1vcpu-1gb-tor1-01.ssh > CPEf81d0fa0c6a3-CMf81d0fa0c6a0.cpe.net.fido.ca.61941: Flags [P.], seq 39424:40660, ack 1, win 859, options [nop,nop,TS val 2055055199 ecr 411459371], length 1236
13:38:08.776804 IP lamp-s-1vcpu-1gb-tor1-01.ssh > CPEf81d0fa0c6a3-CMf81d0fa0c6a0.cpe.net.fido.ca.61941: Flags [P.], seq 40660:40912, ack 1, win 859, options [nop,nop,TS val 2055055199 ecr 411459371], length 252
13:38:08.776920 IP lamp-s-1vcpu-1gb-tor1-01.ssh > CPEf81d0fa0c6a3-CMf81d0fa0c6a0.cpe.net.fido.ca.61941: Flags [P.], seq 40912:41164, ack 1, win 859, options [nop,nop,TS val 2055055199 ecr 411459371], length 252
13:38:08.777039 IP lamp-s-1vcpu-1gb-tor1-01.ssh > CPEf81d0fa0c6a3-CMf81d0fa0c6a0.cpe.net.fido.ca.61941: Flags [P.], seq 41164:41416, ack 1, win 859, options [nop,nop,TS val 2055055199 ecr 411459371], length 252
13:38:08.777151 IP lamp-s-1vcpu-1gb-tor1-01.ssh > CPEf81d0fa0c6a3-CMf81d0fa0c6a0.cpe.net.fido.ca.61941: Flags [P.], seq 41416:41668, ack 1, win 859, options [nop,nop,TS val 2055055200 ecr 411459371], length 252
13:38:08.777263 IP lamp-s-1vcpu-1gb-tor1-01.ssh > CPEf81d0fa0c6a3-CMf81d0fa0c6a0.cpe.net.fido.ca.61941: Flags [P.], seq 41668:41920, ack 1, win 859, options [nop,nop,TS val 2055055200 ecr 411459371], length 252
13:38:08.777374 IP lamp-s-1vcpu-1gb-tor1-01.ssh > CPEf81d0fa0c6a3-CMf81d0fa0c6a0.cpe.net.fido.ca.61941: Flags [P.], seq 41920:42172, ack 1, win 859, options [nop,nop,TS val 2055055200 ecr 411459371], length 252
13:38:08.777487 IP lamp-s-1vcpu-1gb-tor1-01.ssh > CPEf81d0fa0c6a3-CMf81d0fa0c6a0.cpe.net.fido.ca.61941: Flags [P.], seq 42172:42424, ack 1, win 859, options [nop,nop,TS val 2055055200 ecr 411459371], length 252
13:38:08.777598 IP lamp-s-1vcpu-1gb-tor1-01.ssh > CPEf81d0fa0c6a3-CMf81d0fa0c6a0.cpe.net.fido.ca.61941: Flags [P.], seq 42424:42676, ack 1, win 859, options [nop,nop,TS val 2055055200 ecr 411459371], length 252
13:38:08.777709 IP lamp-s-1vcpu-1gb-tor1-01.ssh > CPEf81d0fa0c6a3-CMf81d0fa0c6a0.cpe.net.fido.ca.61941: Flags [P.], seq 42676:42928, ack 1, win 859, options [nop,nop,TS val 2055055200 ecr 411459371], length 252
13:38:08.777819 IP lamp-s-1vcpu-1gb-tor1-01.ssh > CPEf81d0fa0c6a3-CMf81d0fa0c6a0.cpe.net.fido.ca.61941: Flags [P.], seq 42928:43180, ack 1, win 859, options [nop,nop,TS val 2055055200 ecr 411459371], length 252
13:38:08.777930 IP lamp-s-1vcpu-1gb-tor1-01.ssh > CPEf81d0fa0c6a3-CMf81d0fa0c6a0.cpe.net.fido.ca.61941: Flags [P.], seq 43180:43432, ack 1, win 859, options [nop,nop,TS val 2055055200 ecr 411459371], length 252
13:38:08.778041 IP lamp-s-1vcpu-1gb-tor1-01.ssh > CPEf81d0fa0c6a3-CMf81d0fa0c6a0.cpe.net.fido.ca.61941: Flags [P.], seq 43432:43684, ack 1, win 859, options [nop,nop,TS val 2055055200 ecr 411459371], length 252
13:38:08.778153 IP lamp-s-1vcpu-1gb-tor1-01.ssh > CPEf81d0fa0c6a3-CMf81d0fa0c6a0.cpe.net.fido.ca.61941: Flags [P.], seq 43684:43936, ack 1, win 859, options [nop,nop,TS val 2055055201 ecr 411459371], length 252
13:38:08.778264 IP lamp-s-1vcpu-1gb-tor1-01.ssh > CPEf81d0fa0c6a3-CMf81d0fa0c6a0.cpe.net.fido.ca.61941: Flags [P.], seq 43936:44188, ack 1, win 859, options [nop,nop,TS val 2055055201 ecr 411459371], length 252
13:38:08.778374 IP lamp-s-1vcpu-1gb-tor1-01.ssh > CPEf81d0fa0c6a3-CMf81d0fa0c6a0.cpe.net.fido.ca.61941: Flags [P.], seq 44188:44440, ack 1, win 859, options [nop,nop,TS val 2055055201 ecr 411459371], length 252
13:38:08.778490 IP lamp-s-1vcpu-1gb-tor1-01.ssh > CPEf81d0fa0c6a3-CMf81d0fa0c6a0.cpe.net.fido.ca.61941: Flags [P.], seq 44440:44692, ack 1, win 859, options [nop,nop,TS val 2055055201 ecr 411459371], length 252
13:38:08.778602 IP lamp-s-1vcpu-1gb-tor1-01.ssh > CPEf81d0fa0c6a3-CMf81d0fa0c6a0.cpe.net.fido.ca.61941: Flags [P.], seq 44692:44944, ack 1, win 859, options [nop,nop,TS val 2055055201 ecr 411459371], length 252
13:38:08.778712 IP lamp-s-1vcpu-1gb-tor1-01.ssh > CPEf81d0fa0c6a3-CMf81d0fa0c6a0.cpe.net.fido.ca.61941: Flags [P.], seq 44944:45196, ack 1, win 859, options [nop,nop,TS val 2055055201 ecr 411459371], length 252
13:38:08.783856 IP CPEf81d0fa0c6a3-CMf81d0fa0c6a0.cpe.net.fido.ca.61941 > lamp-s-1vcpu-1gb-tor1-01.ssh: Flags [.], ack 25336, win 32760, options [nop,nop,TS val 411459372 ecr 2055055186], length 0
13:38:08.783907 IP lamp-s-1vcpu-1gb-tor1-01.ssh > CPEf81d0fa0c6a3-CMf81d0fa0c6a0.cpe.net.fido.ca.61941: Flags [P.], seq 45196:45448, ack 1, win 859, options [nop,nop,TS val 2055055206 ecr 411459372], length 252
13:38:08.783941 IP CPEf81d0fa0c6a3-CMf81d0fa0c6a0.cpe.net.fido.ca.61941 > lamp-s-1vcpu-1gb-tor1-01.ssh: Flags [.], ack 27856, win 32764, options [nop,nop,TS val 411459373 ecr 2055055188], length 0
13:38:08.783965 IP CPEf81d0fa0c6a3-CMf81d0fa0c6a0.cpe.net.fido.ca.61941 > lamp-s-1vcpu-1gb-tor1-01.ssh: Flags [.], ack 28360, win 32756, options [nop,nop,TS val 411459373 ecr 2055055188], length 0
13:38:08.783977 IP CPEf81d0fa0c6a3-CMf81d0fa0c6a0.cpe.net.fido.ca.61941 > lamp-s-1vcpu-1gb-tor1-01.ssh: Flags [.], ack 28864, win 32764, options [nop,nop,TS val 411459374 ecr 2055055188], length 0
13:38:08.783987 IP CPEf81d0fa0c6a3-CMf81d0fa0c6a0.cpe.net.fido.ca.61941 > lamp-s-1vcpu-1gb-tor1-01.ssh: Flags [.], ack 29368, win 32756, options [nop,nop,TS val 411459374 ecr 2055055189], length 0
13:38:08.783998 IP CPEf81d0fa0c6a3-CMf81d0fa0c6a0.cpe.net.fido.ca.61941 > lamp-s-1vcpu-1gb-tor1-01.ssh: Flags [.], ack 29872, win 32748, options [nop,nop,TS val 411459374 ecr 2055055189], length 0
13:38:08.784536 IP lamp-s-1vcpu-1gb-tor1-01.ssh > CPEf81d0fa0c6a3-CMf81d0fa0c6a0.cpe.net.fido.ca.61941: Flags [P.], seq 45448:46884, ack 1, win 859, options [nop,nop,TS val 2055055207 ecr 411459378], length 1436
13:38:08.784732 IP lamp-s-1vcpu-1gb-tor1-01.ssh > CPEf81d0fa0c6a3-CMf81d0fa0c6a0.cpe.net.fido.ca.61941: Flags [P.], seq 46884:47136, ack 1, win 859, options [nop,nop,TS val 2055055207 ecr 411459378], length 252
13:38:08.784949 IP lamp-s-1vcpu-1gb-tor1-01.ssh > CPEf81d0fa0c6a3-CMf81d0fa0c6a0.cpe.net.fido.ca.61941: Flags [P.], seq 47136:47388, ack 1, win 859, options [nop,nop,TS val 2055055207 ecr 411459378], length 252
13:38:08.785105 IP lamp-s-1vcpu-1gb-tor1-01.ssh > CPEf81d0fa0c6a3-CMf81d0fa0c6a0.cpe.net.fido.ca.61941: Flags [P.], seq 47388:47640, ack 1, win 859, options [nop,nop,TS val 2055055207 ecr 411459378], length 252
